username|date|retweets|favorites|text|geo|mentions|hashtags|id|permalink
AniB64|2018-05-24 17:35|0|0|"Sounds about right. Remember McConnell’s floor speech on AUMF for Syria."||||"999675171001679872"|https://twitter.com/AniB64/status/999675171001679872
StoicViper|2018-05-22 12:55|0|2|"When listening to @ SecPompeo's speech on Iran, I couldn't help keep nodding to everything he said. It was accurate, from the lies about the # JCPOA to # IRGC strength in places like Syria. Iran is the biggest state sponsor of Terrorism and the Ayatollah regime must be confrontated."||@|# #|"998879913863143426"|https://twitter.com/StoicViper/status/998879913863143426
mythirdventure|2018-05-21 18:40|0|0|"# iran # iranprotest don't manipulate his speech. He did say D revenue & economic benefit is not going 2 people of Iran & it is spend in Gaza & Syria. We, D people of Iran, support Trump decision because D revenue is not going to people. We don't give a shit about Palestine & Gaza"|||# #|"998604340091744257"|https://twitter.com/mythirdventure/status/998604340091744257
gaylelemmon|2018-05-21 17:51|1|1|"On # Iran speech. Notable that on the ground in # Syria earlier this month, much discussion about role of Iran in the country and questions of whether both Russia and Syrian regime also would like to limit that: https://twitter.com/joyce_karam/status/998557241568612352 …"|||# #|"998592133262000128"|https://twitter.com/gaylelemmon/status/998592133262000128
aslamx5|2018-05-21 16:58|0|2|"Is Mike Pompeo the new president of Iran and Syria? @ SecPompeo I didn't hear anywhere in your speech where you talk about Israel nuclear weapons? Is it acceptable for Israel to have nukes and commit aggression against it's neighbours? How about # Saudi killing of Yemenis? # MAGA"||@|# #|"998578769173663744"|https://twitter.com/aslamx5/status/998578769173663744
ColtsPacers_Fan|2018-05-21 04:47|0|0|"CNSNews. Hussein Obama was criticized for playing golf immediately after giving a speech about the brutal beheading of American journalist James Foley by the Islamic State of Iraq & Syria (ISIS). A close look at his presidency shows that Obama’s behavior was part of pattern."||||"998394762708373504"|https://twitter.com/ColtsPacers_Fan/status/998394762708373504
S_Syria_|2018-05-20 15:24|0|0|"Now we’re getting somewhere this isn’t about free speech u just don’t ppl to criticize you"||||"998192866718445568"|https://twitter.com/S_Syria_/status/998192866718445568
AdelsGrail|2018-05-20 15:00|0|0|"I specifically said "like most of you do" and "respect" I'm talking about a specific trend of people using free speech to talk shit. Your intent matters and your method of delivery matters just as much."||||"998186753331621888"|https://twitter.com/AdelsGrail/status/998186753331621888
S_Syria_|2018-05-20 14:54|0|1|"Sorry if u don’t want my opinion don’t show up in my timeline , and second yeah you really don’t understand free speech if that’s what u think about it"||||"998185166915780608"|https://twitter.com/S_Syria_/status/998185166915780608
BenFoldy|2018-05-19 14:42|0|2|"Lisa Wedeen wrote a great book about (pre-war) Syria called Ambiguities of Domination whose thesis was that compelling behavior through culture and speech acts, however ironically, is a cheap and powerful strategy for the state to create coercive compliance and self-regulation"||||"997819832262447104"|https://twitter.com/BenFoldy/status/997819832262447104
zezezebe|2018-05-18 19:42|0|0|""Americans are free to advocate striking Syria" - how about advocating to strike the White House? The argument sounds like a Soviet joke about freedom of speech in the USSR demonstrated by people's ability to denounce Reagan in the middle of Red Square."||||"997532956427108352"|https://twitter.com/zezezebe/status/997532956427108352
miss_speech|2018-05-18 09:03|0|0|"He doesn't know the difference between Libya and Syria, does he. He's talking about the "Libya model" and Qaddafi, and the (seemingly still on the same topic) says "Syria"."||||"997372104722079744"|https://twitter.com/miss_speech/status/997372104722079744
XexorWeglin|2018-05-18 05:17|0|1|"Does this include protecting # Syria from missiles coming from # Israel? How about protecting them from us and our interference in a sovereign country's affairs? Or was "we do not seek to impose our way of life on anyone" in @ realDonaldTrump's inaugural speech just smoke?"||@|# #|"997315209915260930"|https://twitter.com/XexorWeglin/status/997315209915260930
geopconsulting|2018-05-17 21:25|0|0|"Donald Trump has no idea what he's talking about, in the end of his speech he mixes up Libya with Syria. Nevertheless, if Kim Jong Un meets with Trump after these threats, it won't end well for him. https://twitter.com/ABC/status/997183809635287040 …"||||"997196398423691265"|https://twitter.com/geopconsulting/status/997196398423691265
ALCJHR|2018-05-16 17:25|13|12|"Must Read! # Turkish historian's speech for @ WorldatMitchell award. Confronting denial of # ArmenianGenocide is not about the past, but about # Turkey's present and its relations with # Armenian/s, # Kurds, minorities & its neighbors. http://worldwithoutgenocide.org/dr-akcams-remarks … # Syria # Greece # Israel"||@|# # # # # # # #|"996773746521333765"|https://twitter.com/ALCJHR/status/996773746521333765
pisstakenews|2018-05-16 08:32|0|0|"Brilliant speech . If this was Syria, we'd be bombing them into oblivion right about now."||||"996639463056072704"|https://twitter.com/pisstakenews/status/996639463056072704
JohnGordon1963|2018-05-15 13:05|0|0|"@ theresa_may I expect you will banging on about the human rights of the Palestinian people with an impassioned plea to the HOC, akin to your outrage over Syria and the Syrian people, as its the "right thing to do" Look forward to your speech."||@||"996345877571698688"|https://twitter.com/JohnGordon1963/status/996345877571698688
AndyEvans77|2018-05-14 23:18|1|6|"If this was Syria, UK and US govts would be tripping over themselves trying to make a speech about how this is unacceptable and a line has been crossed."||||"996137717959446528"|https://twitter.com/AndyEvans77/status/996137717959446528
RickFandango|2018-05-14 20:14|2|2|"I wonder what @ theresa_may & @ BorisJohnson have to say about # Gaza today? The other week the governments dear concern over the deaths of Syrian children was part of a propaganda speech to justifiying bombing Syria."||@ @|#|"996091447479881728"|https://twitter.com/RickFandango/status/996091447479881728
IntelTweet|2018-05-14 18:20|0|0|"Hezbollah Secretary General Hassan Nasrallah has delivered a speech dismissing Israeli "lies... about the elimination of Iranian capabilities in Syria" and boasting "the time of intimidation and threats is over with.""||||"996062703419641857"|https://twitter.com/IntelTweet/status/996062703419641857
StuartBirdman2|2018-05-14 05:48|0|0|"InfoWars founder Alex Jones broke down in tears during a rant about president Donald Trump authorizing an airstrike on Syria Trump said during a speech Friday he was joining forces with France and Britain in a coordinated 'precision strike' in retaliation for a chemical weapons a"||||"995873533707288576"|https://twitter.com/StuartBirdman2/status/995873533707288576
Eyecatcher_Pro|2018-05-13 13:17|0|0|"Kind of ironic the s called Leeds Friends of Syria who allegedly support freedom of speech... there is nothing sinister about them is there?"||||"995623979779067904"|https://twitter.com/Eyecatcher_Pro/status/995623979779067904
grannies4equal|2018-05-13 13:02|0|0|"This is not about challenging main stream thinking. It is about a 'lady warrior' voicing for a totalitarian regime perpetrating genocide & mass ethnic cleansing against the rural & urban poor & workers of Syria who dared to ask for justice. Hate speech, support of warcrimes. pic.twitter.com/KZxgpNCjvX"||||"995620214829146113"|https://twitter.com/grannies4equal/status/995620214829146113
Brian_Whit|2018-05-13 12:19|40|84|"The issue with Vanessa Beeley and the @ merthyrrising festival is not free speech. It's about someone who defends a repressive regime (in Syria) having been invited to take part in an event that celebrates resistance to oppression."||@||"995609506708148229"|https://twitter.com/Brian_Whit/status/995609506708148229
2flamesburning1|2018-05-12 18:36|19|40|"Interesting that @ guardian write about fascist states like USA destroying free speech when themselves pressure events to stop anyone who doesn't agree with their profile syria war narrative to speak . https://twitter.com/PollyTickal/status/995327010015625216 …"||@||"995341949665202177"|https://twitter.com/2flamesburning1/status/995341949665202177
HeinrichAugust2|2018-05-10 15:51|0|1|"This article conveniently neglects to mention the fact that Kucinich has refused to condemn Bashar al-Assad, delivered a paid speech to a pro-Assad group, and traveled to Syria last year to meet the genocidal maniac. But yes, tell me more about what a darling progressive he is."||||"994575586784931842"|https://twitter.com/HeinrichAugust2/status/994575586784931842
SamParmesan|2018-05-10 15:43|1|3|"This article conveniently neglects to mention the fact that Kucinich has refused to condemn Bashar al-Assad, delivered a paid speech to a pro-Assad group, and traveled to Syria last year to meet the genocidal maniac. But yes, tell me more about what a darling progressive he is. https://twitter.com/Slate/status/994396005494861825 …"||||"994573731405189121"|https://twitter.com/SamParmesan/status/994573731405189121
Treat_Me_Gently|2018-05-10 11:56|3|0|". # IranDeal # GolanHeights # Iran @ UKLabour . Cheney, Rumsfeld etc... Necons and the Rise Of The American Empire Powerful speech by General Wesley Clark about Iraq and then Syria and next Iran... https://www.youtube.com/watch?v=zuvV8-82LPQ … ."||@|# # #|"994516503750995968"|https://twitter.com/Treat_Me_Gently/status/994516503750995968
johnstcool|2018-05-09 19:59|0|0|"@ NickFerrariLBC was nice to hear you giving a dam about free speech this morning, maybe this might interest you re syria chemical attack https://www.independent.co.uk/voices/syria-chemical-attack-gas-douma-robert-fisk-ghouta-damascus-a8307726.html …"||@||"994275681512165381"|https://twitter.com/johnstcool/status/994275681512165381
1962Wren|2018-05-09 14:07|0|0|"Watched that speech of hers to the # Aleppo debate again recently, made me sad. I remember at the time being both astonished and delighted that somebody in her position felt just the same way about # Syria as I did."|||# #|"994187074914930688"|https://twitter.com/1962Wren/status/994187074914930688
New_Age_Seeker|2018-05-09 02:52|0|2|"And they could have had the courtesy to pause the show feed during those stupid speeches like abc did for agents of shield when Donald Trump had his stupid speech about bombing Syria"||||"994017283772223489"|https://twitter.com/New_Age_Seeker/status/994017283772223489
kuffodog|2018-05-08 23:12|1|0|"Terrorist Jews attack Syria, sovereign member of UN yet again... while crying like cunts in their media as a chorus for Trump's belligerence and extortion speech on JCPOA, as they shuffle around IDF in Golan Heights, lying about impeding attack by Iran. https://twitter.com/DavidADaoud/status/993944031699914752 …"||||"993961838525083648"|https://twitter.com/kuffodog/status/993961838525083648
AliciaM0325|2018-05-08 22:16|2|3|"So it begins! Did Trump had a chance to be done with his speech about the Iran Nuclear Deal before Israel bombed Syria?"||||"993947846192848896"|https://twitter.com/AliciaM0325/status/993947846192848896
TheGuy_Mo|2018-05-08 22:16|0|0|"So Israel aready attacking Syria after that trump speech. A lot of people about to die coz "Make America great again""||||"993947732510478341"|https://twitter.com/TheGuy_Mo/status/993947732510478341
rafsanchez|2018-05-08 22:01|2|6|"Trump's speech finished less than two hours ago and we already have reports of an Israeli strike in Syria, possibly a pre-emptive attack if Israeli believed Iran was about to launch a strike. Buckle up."||||"993944042806407169"|https://twitter.com/rafsanchez/status/993944042806407169
askeamonn|2018-05-08 21:37|0|1|"and everyone says "America never bombed Syria under Obama", well in Budget '12 speech he bombed t entire Western World of $ t's for W'St pimps & he & ye all got away with it scott-free, so me being you I wouldn't be 'so high &mighty' about American banking over European equivalent"||||"993938042116366337"|https://twitter.com/askeamonn/status/993938042116366337
Bahram_Gooor|2018-05-08 21:22|4|10|"All the points that @ realDonaldTrump made in his speech were completely true about Iran regime. Iran regime used the money given by @ BarackObama to spread terrorism in the Middle East, specifically in Yemen and Syria."||@ @||"993934267494387712"|https://twitter.com/Bahram_Gooor/status/993934267494387712
EnjoyTheSearch|2018-05-08 20:37|0|2|"@ RadGeekpartduex - The thing that strikes me most about this speech was his message to the Iranian people That clip will be circulated within the Iranian communities in 10 mins The Mullahs now have two wars. Syria and at home Trump will destroy his enemy from within - Sun Tzu"||@||"993922817010946049"|https://twitter.com/EnjoyTheSearch/status/993922817010946049
sebusher|2018-05-08 20:09|2|1|"# Israel announcing its troops on high alert for an attack in north of country over suspicious movement by military in syria just as # Trump is about to make his speech on the Iran nuclear deal...."|||# #|"993915841476427776"|https://twitter.com/sebusher/status/993915841476427776
EIWBM_Cat|2018-05-08 10:52|0|4|"(now, if the back brace was where she kept the speech about establishing a no fly zone in Syria, I might care... but... :))"||||"993775534474743809"|https://twitter.com/EIWBM_Cat/status/993775534474743809
Sam080416|2018-05-08 06:58|0|0|"@ charliepick did you see Barnaby Joyce speech as a/g PM about 7April 2017; BJ incoherent; LSales interviewed him bout Trump dropping cruise missiles on Syria. BJ embarrassing; grt material for you; just his misuse of imminent will make u laugh. warwick davis"||@||"993716654491095040"|https://twitter.com/Sam080416/status/993716654491095040
PolitiFact|2018-05-08 02:00|4|13|"# OHGov candidate @ Dennis_Kucinich said he didn’t hide a payment from a group for a speech about Syria. But he didn’t initially disclose the source on his campaign disclosure. https://bit.ly/2FjjSqk pic.twitter.com/4vqSPNO5mB"||@|#|"993641630925238272"|https://twitter.com/PolitiFact/status/993641630925238272
beyondpartypolt|2018-05-07 21:18|0|1|"Pro-war apologists of insane terrorists want UK to bomb Syria. Can't allow free-speech about insane terrorists, their backers, victims of terrorists, how media cover wars - only info on that dictator. Persuaded Leeds Council to ban anti-war seminar by smearing of panel speakers. https://twitter.com/Shelaco/status/993557691753795584 …"||||"993570864053538816"|https://twitter.com/beyondpartypolt/status/993570864053538816
DrLeoStrauss|2018-05-07 19:45|0|1|". @ brhodes, the young Obama staffer w/ a creative writing college degree, mind-melded w/ PBO over essentially sub-tweeting Neocons (& their R2P cousins) from # Syria to # Ukraine after 2011. See Obama’s West Point speech etc. The point? Thread is not snark but about foundations. ##"||@|# # # #|"993547351305441282"|https://twitter.com/DrLeoStrauss/status/993547351305441282
watchman_ray|2018-05-06 06:35|0|0|"PM Netanyahu Gives ‘War Time’ Speech About Iran Nuclear Program After Israel Launches Blistering Missile Strike On Iranian Outposts In Syria https://ift.tt/2HJkoo1 pic.twitter.com/Ir65dYziZS"||||"992986120152670208"|https://twitter.com/watchman_ray/status/992986120152670208
debba1953|2018-05-06 01:58|0|0|"Yeah right gee want to hear about Korea Syria the speech by Macron which both MSNBC and Fox unlike the tabloid CNN talk about a Koolaide drinker"||||"992916481456226304"|https://twitter.com/debba1953/status/992916481456226304
DreamescapePs|2018-05-05 21:28|0|0|"If you call them Alqaeda affilates just say that you don't give a fuck about arab lifes & just care to build Rojava even if it mean to keep the rest of Syria in slavery,freedom of speech shouldn't be abused to smear people who save innocents under the rubbles & get killed for it"||||"992848483097960449"|https://twitter.com/DreamescapePs/status/992848483097960449
TylerDurdenHere|2018-05-05 00:30|0|0|"Plz include this excellent speech by @ georgegalloway in your next piece on # Syria. Amazing it was in 2013 & nothing has changed since, same # fakenews about chemical attacks. ps: guess who is the man sitting beside Galloway (shhhhh ... he is @ jeremycorbyn)https://m.youtube.com/watch?v=WPh4_wWuB6g …"||@ @|# #|"992531997192048641"|https://twitter.com/TylerDurdenHere/status/992531997192048641
techdino|2018-05-04 23:47|0|0|"@ realDonaldTrump OMG Mr. President.. loved, loved, loved your speech at the NRA conference.. you were on fire Though I was pissed about Syria because I think that you were misinformed.. I still support you wholeheartedly"||@||"992521027598110724"|https://twitter.com/techdino/status/992521027598110724
ScottPesner|2018-05-04 13:16|0|0|"Should i pull up the speech where he is ranting he is the law and order candidate How about the dual military interventions in Syria Did you know right now,under Trump there are American troops fighting in Yemen? How is any of that libertarian ,do you know what a libertarian is?"||||"992362306259439616"|https://twitter.com/ScottPesner/status/992362306259439616
2flamesburning1|2018-05-03 22:33|3|2|"Iraqi Shia started a hateful speech in the middle of Damascus about sunni islam .. he was arrested and awaiting expulsion back to Iraq. . Syrian government is secular and refuse hateful religious proselytising. Syria is majority sunni & 15 millions of people live govt area https://twitter.com/Thecenturion7/status/992089819009372161 …"||||"992140013939843072"|https://twitter.com/2flamesburning1/status/992140013939843072
mirandadevine|2018-05-03 13:25|13|40|"NSW Premier @ GladysB gives a charming speech about her childhood in North Ryde as the conscientious daughter of Armenian migrants (via Syria), neither of whom finished high school. # sydneyinstitute"||@|#|"992002253853609984"|https://twitter.com/mirandadevine/status/992002253853609984
RussiaConnects|2018-05-03 10:49|8|8|"It seems @ BBC @ Guardian @ TheTimes & @ SkyNews wish to negate & nullify any alternate view on Syria. What does this say about their supposed defense of free speech or their supposed support of dissent in times when all around approve war? @ JohnSimpsonNews @ BowenBBC @ bbclysedoucetpic.twitter.com/93AOROHwHo"||@ @ @ @ @ @ @||"991962933935722496"|https://twitter.com/RussiaConnects/status/991962933935722496
haloefekti|2018-05-02 22:24|2|4|"Gadaffi gives a speech about American wars as Syria 's Assad laugh at his claims. Would not laugh now. (Not the actual video which I watched this morning, but screencapture) pic.twitter.com/Pa3nj0VGai"||||"991775531938041856"|https://twitter.com/haloefekti/status/991775531938041856
watchman_ray|2018-05-02 02:49|0|0|"PM Netanyahu Gives ‘War Time’ Speech About Iran Nuclear Program After Israel Launches Blistering Missile Strike On Iranian Outposts In Syria https://ift.tt/2HJkoo1 pic.twitter.com/CN4Um2IBC7"||||"991479811775389697"|https://twitter.com/watchman_ray/status/991479811775389697
eRepublicUSA|2018-05-02 02:42|0|0|"there are other quotes by Bibi where he says nasty things about the US in secret. Gotta realize he can blackmail anyone in Congress... plus, Rothschilds need more central banks in Iran/Syria + MIC needs wars. Bibi got 29 standing ovations in his speech to Congress in 2011 (?)"||||"991477897243209728"|https://twitter.com/eRepublicUSA/status/991477897243209728
RawDawgBuffalo|2018-05-01 18:36|0|0|"Israel Closes Airspace Near Syria Ahead of Netanyahu Speech With “Dramatic News About Iran”; Oil Surges https://www.zerohedge.com/news/2018-04-30/israel-closes-airspace-near-syria-border-ahead-significant-netanyahu-speech-iran …"||||"991355652810461185"|https://twitter.com/RawDawgBuffalo/status/991355652810461185
anas_syria|2018-05-01 17:44|0|0|"Here’s what the internet had to say about Netanyahu's Iran speech https://youtu.be/Ej3dm75koCI  via @ YouTube"||@||"991342700728287233"|https://twitter.com/anas_syria/status/991342700728287233
LaurenceKendal1|2018-05-01 15:21|1|4|"The recent attack on the Syrian Military Base and Bibi's recent speech about Iran's quest for the bomb and rumors that Israeli jets penetrated Iranian airspace undetected, show Netanyahu is going all out to start in a war Syria/Iran or get the U.S. to do it for him."||||"991306546234699777"|https://twitter.com/LaurenceKendal1/status/991306546234699777
1Anson1|2018-05-01 14:52|0|0|"PM Netanyahu Gives 'War Time' Speech About Iran Nuclear Program After Israel Launches Blistering Missile Strike On Iranian Outposts In Syria • Now The End Begins The Syrian army confirmed that Sunday that several military bases in northern Syria were struck in an attack blamed"||||"991299307084173312"|https://twitter.com/1Anson1/status/991299307084173312
Hamburg_klein|2018-05-01 13:09|0|0|"BREAKING: WE WILL BE LIED TO ONCE AGAIN VIA A SPEECH AT 8PM. TUNE IN AND MAKE SURE NOT TO MISS THE NEW LIES FROM THE OG LIAR WHO’S UNIQUELY QUALIFIED FOR THIS ROLE GIVEN HIS EXPERIENCE LYING TO US ABOUT IRAQ AND SYRIA"||||"991273286553260032"|https://twitter.com/Hamburg_klein/status/991273286553260032
Hamburg_klein|2018-05-01 13:08|0|0|"BREAKING: WE WILL BE LIED TO ONCE AGAIN VIA A SPEECH AT 8PM. TUNE IN AND MAKE SURE NOT TO MISS THE NEW LIES FROM THE OG LIAR WHO’S UNIQUELY QUALIFIED FOR THIS ROLE GIVEN HIS EXPERIENCE LYING TO US ABOUT IRAQ AND SYRIA"||||"991273023163584512"|https://twitter.com/Hamburg_klein/status/991273023163584512
noiranwarorg|2018-05-01 11:15|0|0|"Watch the fool version of the madman's speech and remember this: They lied to you about Iraq. They lied to you about Libya. They lied to you about Syria. And now they are lying about Iran. NO IRAN WAR! NO IRAQ, LIBYA, SYRIA REVISITED! https://www.facebook.com/noiranwar.org/posts/1682059295247545 …"||||"991244671203598336"|https://twitter.com/noiranwarorg/status/991244671203598336
janoberg|2018-05-01 08:27|1|4|"EARLY WARNING Suspected Israeli strikes hit Iran-linked targets in Syria, escalating regional tensions Together with Netanyauhu's speech last night about Iran's breaking the JPCOA nuclear deal a very serious situation. pic.twitter.com/0VW3SByQHY"||||"991202388173344768"|https://twitter.com/janoberg/status/991202388173344768
infocyde|2018-05-01 05:23|0|1|"PM Netanyahu Gives ‘War Time’ Speech About Iran Nuclear Program After Israel Launches Blistering Missile Strike On Iranian Outposts In Syria http://www.nowtheendbegins.com/pm-netanyahu-to-give-speech-after-israel-launches-blistering-missile-strike-on-iranian-outposts-in-syria/ …"||||"991156239508889600"|https://twitter.com/infocyde/status/991156239508889600
deepspaceprobe2|2018-05-01 05:10|0|0|"Israel Closes Airspace Near Syria Border Ahead Of Netanyahu Speech With "Dramatic News About Iran" https://www.zerohedge.com/news/2018-04-30/israel-closes-airspace-near-syria-border-ahead-significant-netanyahu-speech-iran …"||||"991152734341656577"|https://twitter.com/deepspaceprobe2/status/991152734341656577
1Anson1|2018-05-01 04:31|0|0|"PM Netanyahu Gives ‘War Time’ Speech About Iran Nuclear Program After Israel Launches Blistering Missile Strike On Iranian Outposts In Syria http://www.nowtheendbegins.com/pm-netanyahu-to-give-speech-after-israel-launches-blistering-missile-strike-on-iranian-outposts-in-syria/ …"||||"991142955418374144"|https://twitter.com/1Anson1/status/991142955418374144
HaroldHodson2|2018-05-01 03:51|0|0|"PM Netanyahu Gives ‘War Time’ Speech About Iran Nuclear Program After Israel Launches Blistering Missile Strike On Iranian Outposts In Syria http://www.nowtheendbegins.com/pm-netanyahu-to-give-speech-after-israel-launches-blistering-missile-strike-on-iranian-outposts-in-syria/ …"||||"991132930226376704"|https://twitter.com/HaroldHodson2/status/991132930226376704
ibangel|2018-05-01 02:56|0|0|"PM Netanyahu Gives 'War Time' Speech About Iran Nuclear Program After Israel Launches Blistering Missile Strike On Iranian Outposts In Syria • Now The End Begins http://www.nowtheendbegins.com/pm-netanyahu-to-give-speech-after-israel-launches-blistering-missile-strike-on-iranian-outposts-in-syria/ …"||||"991119046237044736"|https://twitter.com/ibangel/status/991119046237044736
CynthiaPirl|2018-05-01 02:49|0|0|""Israel Closes Airspace Near Syria Border Ahead Of Netanyahu Speech With "Dramatic News About Iran"; Oil Surges" https://www.zerohedge.com/news/2018-04-30/israel-closes-airspace-near-syria-border-ahead-significant-netanyahu-speech-iran … # Pray4DJT"|||#|"991117278807642112"|https://twitter.com/CynthiaPirl/status/991117278807642112
mzl953|2018-05-01 02:21|0|0|"PM Netanyahu Gives ‘War Time’ Speech About Iran Nuclear Program After Israel Launches Blistering Missile Strike On Iranian Outposts In Syria http://www.nowtheendbegins.com/pm-netanyahu-to-give-speech-after-israel-launches-blistering-missile-strike-on-iranian-outposts-in-syria/ …"||||"991110336957812736"|https://twitter.com/mzl953/status/991110336957812736
redheadgeometry|2018-05-01 01:32|0|0|"Israel Closes Airspace Near Syria Border Ahead Of Netanyahu Speech With "Dramatic News About Iran"; Oil Surges | Zero Hedge https://www.zerohedge.com/news/2018-04-30/israel-closes-airspace-near-syria-border-ahead-significant-netanyahu-speech-iran …. The book can not be imitated played out like a game of cards,blessed are the peaceful for their souls contain GOd, in truth &love"||||"991098051266826240"|https://twitter.com/redheadgeometry/status/991098051266826240
