username|date|retweets|favorites|text|geo|mentions|hashtags|id|permalink
leo_shane|2018-04-18 05:03|0|0|"Exactly, and Macrons speech at the EU Parliament was also got criticised by some MPs but the most ridiculous part of his speech was that he said, France defended the honour of EU by attacking Syria. Now its not about so called "chemical attack" but about defending honor."||||"986440023867195393"|https://twitter.com/leo_shane/status/986440023867195393
Arjan85793531|2018-04-18 03:52|0|0|"The Best Speech From Donald Trump About Syria and North Korea Concerning War # Topbuzzhttp://www.topbuzz.com/article/i6545592991229149705?user_id=6501436932826858505&language=en&region=us&app_id=1222&impr_id=6545599812438329609&gid=6545592991229149705&c=tw&language=en …"|||#|"986422137392164867"|https://twitter.com/Arjan85793531/status/986422137392164867
aborland30|2018-04-18 02:43|0|0|"Wow! Such a scandal! A speech about peace in Syria that spoke neither good or bad of Assad. A disgusting smear! Where's the article about all the corporate money @ RichCordray has taken? https://twitter.com/Enquirer/status/986399559847854080 …"||@||"986404817533779969"|https://twitter.com/aborland30/status/986404817533779969
SeanForgotAgain|2018-04-18 01:44|0|0|"An awful lot of whataboutism and very little legitimate defense. “Cordray is slinging mud about Syria but . . . (GUNS! GUNS! SQUIRREL!) [here’s a speech excerpt where I defend Assad and don’t even mention his documented war crimes] but (CORDRAY GUNS NRA GUNS SQUIRREL!)”"||||"986389865033068546"|https://twitter.com/SeanForgotAgain/status/986389865033068546
TrutherTracy|2018-04-18 01:10|0|0|"Watch "What Mainstream Media's NOT Telling You About Trump's "Syria Speech!"" on YouTube https://youtu.be/a4ON2Ud6-Yg"||||"986381356954505216"|https://twitter.com/TrutherTracy/status/986381356954505216
plasmaglyphs|2018-04-17 23:58|0|0|"What Mainstream Media's NOT Telling You About Trump's "Syria Speech!" https://youtu.be/a4ON2Ud6-Yg  via @ YouTube"||@||"986363400480411648"|https://twitter.com/plasmaglyphs/status/986363400480411648
fascinatorfun|2018-04-17 22:21|0|3|"And I was touched by your speech in the house about Syria and the children suffering as a result of our (the International Community’s) neglect. Thank you. It was heartfelt. That matters."||||"986338842474139648"|https://twitter.com/fascinatorfun/status/986338842474139648
Heidi_LDN|2018-04-17 21:48|4|10|"My speech in today’s debate about Syria and the process by which decisions about military action are taken: https://bit.ly/2H6wzuy pic.twitter.com/XHbKtUJVHl"||||"986330527039983616"|https://twitter.com/Heidi_LDN/status/986330527039983616
AlanMcpartlands|2018-04-17 20:44|0|0|"Well done to those Irish MEPs who protested about the criminal attack on # Syria during the speech of Peter Pan, otherwise known as the President of France. Watch out folks or he might tell his Mammy on ye....sorry his wife???n @ FranceinIreland"||@|#|"986314435240366080"|https://twitter.com/AlanMcpartlands/status/986314435240366080
lucy_kong|2018-04-17 17:33|1|7|"Is it just me or does the only time May has seemed proficient in her speech & mannerisms was over the bombing of Syria. Although just heard her on the radio say no parliamentary vote on bombing due to wanting to keep it secret!! Did she forget Trump was tweeting about it?"||||"986266336018993152"|https://twitter.com/lucy_kong/status/986266336018993152
WesBez|2018-04-17 16:45|0|0|"Watch @ EstherMcVey1 of the @ Conservatives speech today about the children of # Syria. Talking about blood stained clothes of the children yet her department has cracked down on the disabled and poor. Were is the compassion for your own citizens. I put to you, you are two faced."||@ @|#|"986254314955071489"|https://twitter.com/WesBez/status/986254314955071489
katielfrank|2018-04-17 15:44|8|26|"@ Jacob_Rees_Mogg made a fantastic speech about the constitution and the Armed Forces Bill in regards to Syria."||@||"986239010245754881"|https://twitter.com/katielfrank/status/986239010245754881
sulaAlice|2018-04-17 14:56|3|3|"have turned @ jeremycorbyn debate on again, may still reading her speech, saying that war powers act would not have allowed her to bomb Syria @ Conservatives now giving hypothetical egs of when who knows, a war powers Act may not apply from what I understand, it's all about May"||@ @||"986227020068737024"|https://twitter.com/sulaAlice/status/986227020068737024
FaithCsHope|2018-04-17 13:06|0|0|"I liked a @ YouTube video http://youtu.be/a4ON2Ud6-Yg?a  What Mainstream Media's NOT Telling You About Trump's "Syria Speech!""||@||"986199123366957056"|https://twitter.com/FaithCsHope/status/986199123366957056
Joseph76346177|2018-04-17 13:03|0|0|"I admire your support & actions for the innocent kids of Syria. But I got a question for you. What do you do about an innocent African-American girl crying while giving speech about police brutality on blacks in America? I would like to know where you stand on this issue? Thanks"||||"986198472075313152"|https://twitter.com/Joseph76346177/status/986198472075313152
reimageme2|2018-04-17 11:58|0|0|"# SyriaStatement One of @ theresa_may's many crimes against British democracy. 1. Hoped for elected dictatorship 2. Henry VIII powers 3. Denying parliament vote on Brexit deal 4. Canceling 2018 Queens speech 5. Lied to Queen about DUP support 6. Bombing Syria w/out vote"||@|#|"986181989756751872"|https://twitter.com/reimageme2/status/986181989756751872
j_minnow|2018-04-17 10:55|0|3|"Theresa May disgustingly shamelessly pretending to care about Syria in the Commonwealth speech. Days after bombing it. # HandsOffTheMiddleEast # Commonwealth"|||# #|"986166238979198976"|https://twitter.com/j_minnow/status/986166238979198976
PaulAdams72|2018-04-17 08:18|0|0|"Corbyn gives brilliant speech he not only shows he really cares about what happens in # Syria but actually understands what is happening in there in a wider geopolitical context. # JC4PM # Toriesouthttps://youtu.be/6fLxsErMzP0"|||# # #|"986126628173615104"|https://twitter.com/PaulAdams72/status/986126628173615104
miriwood|2018-04-17 06:38|2|6|"1/ In the final debate, Clinton made her focus the obliteration of # Syria, bragging about her role in obliterating # Libya. So, yeah, this is a slight +. Trump's acceptance speech was unprecedented in statesmanship, but he immediately went downhill, beginning w/Jerusalem."|||# #|"986101644248145921"|https://twitter.com/miriwood/status/986101644248145921
ShiraGlenora|2018-04-17 00:23|0|0|"@ SenSanders Hey Bernie, are you going to make a speech about how the US “overreacted” to the use of chemical weapons in Syria? Why are you so obsessed with Israel. Are you on your Meds? Have you seen your psychiatrist lately? @ janschakowsky @ RepJohnYarmuth @ SenFeinsteinhttps://twitter.com/timesofisrael/status/986002798776008704 …"||@ @ @ @||"986007204493963264"|https://twitter.com/ShiraGlenora/status/986007204493963264
BelieveInBrexit|2018-04-16 23:44|0|1|"Prime Minister @ theresa_may speech to @ UKParliament today about the strike in Syria. The evidence is convincing and as a leading nation we stepped up. We are also grateful to our military who are fighting terrorism across the globe https://twitter.com/10downingstreet/status/985898494127816706 …"||@ @||"985997319127617536"|https://twitter.com/BelieveInBrexit/status/985997319127617536
sophygardner|2018-04-16 23:41|4|11|"Today, despite the important debate on Syria, the most powerful voice was @ DavidLammy talking about # windrush It was the most amazing speech and I was honestly actually applauding him from my kitchen."||@|#|"985996702325923842"|https://twitter.com/sophygardner/status/985996702325923842
SandyBeachesAkl|2018-04-16 23:40|2|5|"What does @ MaramaDavidson @ JulieAnneGenter think about the speech from Macron - thanking NZ for their support in the bombing of Syria??? Ms Ardern made a captains call yet again # lookatme # flipflop @ NZGreens"||@ @ @|# #|"985996280198410240"|https://twitter.com/SandyBeachesAkl/status/985996280198410240
CharlesKeen|2018-04-16 23:29|0|0|"Just now seeing @ realDonaldTrump 's LIVE speech about Syria.. his hair looks like it's being blurred out.. is it just me? pic.twitter.com/opR12v4kqa"||@||"985993636574789632"|https://twitter.com/CharlesKeen/status/985993636574789632
songadaymann|2018-04-16 22:16|1|7|"This feels like a bit of a zig when the news is zagging, but I think it's still relevant. I made a song about @ adampally's ecellent @ shortyawards speech last night. Syria, Trump, everything else happening in the world and he's giving an award to a brand. "This Is Hell" pic.twitter.com/EXVYcNLxJp"||@ @||"985975134577192961"|https://twitter.com/songadaymann/status/985975134577192961
allanholloway|2018-04-16 21:11|0|0|"@ Alison_McGovern making a splendid speech about Syria. Putting the blame firmly where it belongs - on Assad - for the start & continuation of the conflict and deliberate targeting of civilians. Interesting to see how the Labour frontbench responds # Syria"||@|#|"985958809133821953"|https://twitter.com/allanholloway/status/985958809133821953
DoctorRandall|2018-04-16 21:07|0|0|"What Mainstream Media's NOT Telling You About Trump's "Syria Speech!" https://youtu.be/a4ON2Ud6-Yg  via @ YouTube"||@||"985957862148071424"|https://twitter.com/DoctorRandall/status/985957862148071424
agadastephenmic|2018-04-16 20:40|0|0|"@ CNN what's the difference between Hailey's speech and other speeches made about Syria...stop twisting issues. You have attacked Trump for like ever still the guy is still available Monday to Sunday."||@||"985951169649565696"|https://twitter.com/agadastephenmic/status/985951169649565696
lorengrush|2018-04-16 20:26|1|34|"Pence starts of his speech at the space symposium with... talk about Syria"||||"985947565563830273"|https://twitter.com/lorengrush/status/985947565563830273
hapoel2018|2018-04-16 18:34|578|1187|"The hate and the anger in Blairite MP Chris Leslie's speech in Parliament about his support for Bombing Syria was truly frightening. When he added his comments about Russia, it was really like he was ready for WW3. Having such fanatics in Parliament is beyond dangerous."||||"985919450112315393"|https://twitter.com/hapoel2018/status/985919450112315393
davdonsha|2018-04-16 18:14|0|0|"What Mainstream Media Is NOT Telling You About Trump's "Syria Speech" http://www.renegadetribune.com/mainstream-media-not-telling-trumps-syria-speech/ …"||||"985914452888489985"|https://twitter.com/davdonsha/status/985914452888489985
marksw10|2018-04-16 18:04|0|1|"Theresa May giving her speech to Parliament about the UK's involvement in the # Syria missile attack! # NotInMyNameTheresaMaypic.twitter.com/cXaFLzWqGQ"|||# #|"985911846036299776"|https://twitter.com/marksw10/status/985911846036299776
VictoriaPrentis|2018-04-16 18:02|11|16|"A clear and strong speech from the PM this afternoon about the military strikes in Syria. @ theresa_may @ 10DowningStreet"||@ @||"985911428552052737"|https://twitter.com/VictoriaPrentis/status/985911428552052737
Sabina1956|2018-04-16 18:02|0|1|"@ theresa_may While hearing your speech at # UKParliament about "giving # Syria stability,giving syrians # humanrights & peace,giving # ME stability" I tell you: If you have been causing the problem, then you cannot be the solution". # HandsOffSyria"||@|# # # # #|"985911355365523457"|https://twitter.com/Sabina1956/status/985911355365523457
MickeyTis|2018-04-16 18:00|0|1|"Why has @ theresa_may even bothered to turn up just to give her glare of superiority and lies about Syria even in her initial speech she started saying it was down to Labour's rules that make her and trumps actions legal oh and the tag along French guy (couldn't remember name)"||@||"985910905769791488"|https://twitter.com/MickeyTis/status/985910905769791488
JosephMooreJr|2018-04-16 17:49|0|0|"At 6:53, US Secretary of Defense says, “We don’t have any evidence that Syria orchestrated the attack.” What Mainstream Media's NOT Telling You About Trump's "Syria Speech!" https://youtu.be/a4ON2Ud6-Yg  via @ YouTube"||@||"985908063130529793"|https://twitter.com/JosephMooreJr/status/985908063130529793
LittleDavey1978|2018-04-16 17:48|3|6|"Lots of Heckling of @ jeremycorbyn in the HoC over his speech on Syria. I have to say I am 100% behind him. I guess the heckling was more about the fact he can’t be bought, and the fact that his speech goes against the grain of the establishment that want you to believe the lies"||@||"985907906691387392"|https://twitter.com/LittleDavey1978/status/985907906691387392
petermoth1|2018-04-16 17:34|0|0|"Fabulous speech by the PM about Syria, fair play to the government having the balls to do something to help others # Syria"|||#|"985904270859014144"|https://twitter.com/petermoth1/status/985904270859014144
larapawson|2018-04-16 17:26|0|2|"Indeed, the PM's speech, right now, on Syria, is also part of that. Nevermind Yemen. She's this humane, caring, righteous leader who cares about children. Who cares about doing right."||||"985902190270218245"|https://twitter.com/larapawson/status/985902190270218245
AmayiTaina|2018-04-16 17:09|0|1|"I liked a @ YouTube video http://youtu.be/a4ON2Ud6-Yg?a  What Mainstream Media's NOT Telling You About Trump's "Syria Speech!""||@||"985897939238301698"|https://twitter.com/AmayiTaina/status/985897939238301698
jacksonorleans1|2018-04-16 16:41|0|0|"no the only liar is you and your staff. Comey served under 3 presidents without a problem then you come along and lie about everything. You tell alternate truths and can't even read when you are announcing you went to war in Syria. The reading of the prepared speech 5th grade."||||"985890894737035264"|https://twitter.com/jacksonorleans1/status/985890894737035264
GeraldWThomas|2018-04-16 15:15|0|0|"What Mainstream Media's NOT Telling You About Trump's "Syria Speech!" Highimpactflix https://www.youtube.com/attribution_link?a=pDk7Rl_tuZI&u=%2Fwatch%3Fv%3Da4ON2Ud6-Yg%26feature%3Dshare …"||||"985869351575224320"|https://twitter.com/GeraldWThomas/status/985869351575224320
Reptoid_Hunter|2018-04-16 15:13|0|0|"What Mainstream Media's NOT Telling You About Trump's "Syria Speech!" https://youtu.be/a4ON2Ud6-Yg  via @ YouTube"||@||"985868802075385857"|https://twitter.com/Reptoid_Hunter/status/985868802075385857
AyariTarek|2018-04-16 14:46|0|0|"خطاب ميشال عون في القمة العربية،لم ينقلها الإعلام The speech of Michel Aoun the president of Liban in the Arab summit in KSA , which is not conveyd by the official arab Media. Nothing strange, he talked about Arab betrayal of Syria and Palestine https://www.youtube.com/watch?v=96p9MIkxbrg …"||||"985862077700034560"|https://twitter.com/AyariTarek/status/985862077700034560
MITFlunkie|2018-04-16 14:44|0|1|"Pretty sad for the country Trump said this about: "The United States has a lot to offer, with the greatest and most powerful economy in the history of the world." (In his speech bombing during the Syria bombing)"||||"985861397673365504"|https://twitter.com/MITFlunkie/status/985861397673365504
HuffPostUKPol|2018-04-16 11:16|5|3|". @ paulwaugh's # WaughZone is back - Theresa May to make speech about Syria bombings as Parliament returns following recess -Emergency debate on Syria possible - Jeremy Corbyn's 'War Powers Act' - James Comey on 'morally unfit' Donald Trump - # Windrush http://huffp.st/QqhiOSq pic.twitter.com/6vzQgO2753"||@|# #|"985809138495213568"|https://twitter.com/HuffPostUKPol/status/985809138495213568
niccareem|2018-04-16 10:53|0|0|"Great thing about living in a democracy is we have the right to disagree with our leaders without the danger of being ‘bumped off’ by MI5. However, not all respect the value of free speech. A former MP has threatened to block me if I continue to voice criticism of Syria attack"||||"985803391531212800"|https://twitter.com/niccareem/status/985803391531212800
screaminkid|2018-04-16 10:53|1|2|"VIDEO: Carla Ortiz delivers powerful speech about Syria to the United Nations https://aml.ink/dGxj-  via @ thearabsource"||@||"985803358060474368"|https://twitter.com/screaminkid/status/985803358060474368
SylvieKauffmann|2018-04-16 10:21|2|1|"Not necessarily. Bear in mind that it was an interview, not a speech : it was the two interviewers' choice to focus 1/ on Syria, 2/ on domestic policy and to talk about Europe only at the end."||||"985795387469508608"|https://twitter.com/SylvieKauffmann/status/985795387469508608
RonMooreMoreRon|2018-04-16 10:11|7|6|"Today in HoC, whilst talking about how # ToriesBombedSyria every Tory MP will start his/her ‘concerned about Syria’ speech with ‘It can’t be right that ...’ But 99% will be unable to indicate any instance of mentioning it since Cameron shut down by democracy. # ToryHypocritespic.twitter.com/23h37YAeE6"|||# #|"985792746710622208"|https://twitter.com/RonMooreMoreRon/status/985792746710622208
EdressKhasheh|2018-04-16 09:57|0|0|"Orang guy threw 103 missiles on Syrian ppl and in a perfect speech whic all lie, blamming syria about use of chemical weapon, all f lie. # un is an empire not un."|||#|"985789160467263488"|https://twitter.com/EdressKhasheh/status/985789160467263488
haraldpflueger|2018-04-16 09:39|0|0|"‘Anyone still thinking about Syria’s collapse in favor of US, Israel is delusional’ – Nasrallah: Hezbollah’s Secretary General Sayyed Hassan Nasrallah released a televised speech on Sunday that discussed a number of topics, including the latest US-led... http://bit.ly/2qzMebp"||||"985784619479064576"|https://twitter.com/haraldpflueger/status/985784619479064576
Kazeroo87|2018-04-16 08:17|0|0|"What a speech calling out politicians about refusing to be interviewed over Syria! Good to see passionate and open reporting without party lines/alliances @ piersmorgan @ GMB"||@ @||"985764091728941056"|https://twitter.com/Kazeroo87/status/985764091728941056
sandrablaine9|2018-04-16 07:34|0|0|"Were you not listening. President Trump stated in his speech this is not about regime change, or staying in Syria and lastly, said it's the responsibility of the Syrian people to decide its fate."||||"985753197200293888"|https://twitter.com/sandrablaine9/status/985753197200293888
NasdaqPat|2018-04-16 05:53|0|0|"@ rogerwaters Great speech at your concert about the lies that are being told about # Syria # Douma etc. Our UK politicians (not just Govt.) & MSM are in serious trouble because some of us Plebs are starting to learn the extent of the swamp that is the # Gangof3's Establishment."||@|# # #|"985727889072181248"|https://twitter.com/NasdaqPat/status/985727889072181248
PamelaWilcox12|2018-04-16 05:49|0|1|"What Mainstream Media's NOT Telling You About Trump's "Syria Speech!" https://www.youtube.com/watch?v=a4ON2Ud6-Yg&feature=share …"||||"985726960469970944"|https://twitter.com/PamelaWilcox12/status/985726960469970944
Stephy31uk|2018-04-16 05:44|0|0|"This is what we need governmnets to sort out, not bombing Syria, not about about hate speech, not about who can enter or not a country. For christ sake show that you are human and care. Get this HELL STOPPED. https://twitter.com/EdieGegolick/status/979065170231156736 …"||||"985725617504210944"|https://twitter.com/Stephy31uk/status/985725617504210944
dierdead|2018-04-16 05:04|0|0|"What Mainstream Media's NOT Telling You About Trump's "Syria Speech!" https://youtu.be/a4ON2Ud6-Yg  via @ YouTube/ sounds about right."||@||"985715582669553664"|https://twitter.com/dierdead/status/985715582669553664
astro_puppy|2018-04-16 04:15|0|0|"“we all confront difficult questions about how to prevent the slaughter of civilians by their own govt... force can be justified on humanitarian grounds, as it was in the Balkans.” -Obama’s Nobel speech Then he blocked his own admin’s tiny No Fly Zone plan in Syria. # EPICFAIL"|||#|"985703189084241921"|https://twitter.com/astro_puppy/status/985703189084241921
UltrascanMENA|2018-04-16 03:41|0|0|"'Anyone still thinking about Syria's collapse in favor of US, Israel is delusional' – Nasrallah: BEIRUT, LEBANON (3:35 A.M.) – Hezbollah's Secretary General Sayyed Hassan Nasrallah released a televised speech on Sunday that discussed a number of topics,… http://dlvr.it/QPfQcn"||||"985694727566585856"|https://twitter.com/UltrascanMENA/status/985694727566585856
somewheredelta|2018-04-16 03:01|0|0|"I added a video to a @ YouTube playlist http://youtu.be/a4ON2Ud6-Yg?a  What Mainstream Media's NOT Telling You About Trump's "Syria Speech!""||@||"985684555070877698"|https://twitter.com/somewheredelta/status/985684555070877698
penthiselea|2018-04-15 23:18|0|4|"Haha, he is more intelligent than your # StableGenius. He understands what he’s talking about... watch the speech of # Spanky on Syria (or read his Tweets) ... DJT has no clue."|||# #|"985628344350887936"|https://twitter.com/penthiselea/status/985628344350887936
Lords_Day|2018-04-15 23:06|0|0|"I added a video to a @ YouTube playlist http://youtu.be/a4ON2Ud6-Yg?a  What Mainstream Media's NOT Telling You About Trump's "Syria Speech!""||@||"985625553351970824"|https://twitter.com/Lords_Day/status/985625553351970824
ElectroPig|2018-04-15 21:48|0|0|"What Mainstream Media's NOT Telling You About Trump's "Syria Speech!" https://youtu.be/a4ON2Ud6-Yg  via @ HighImpactFlix"||@||"985605915368935425"|https://twitter.com/ElectroPig/status/985605915368935425
Toriesin6words|2018-04-15 21:47|0|0|"Interestingly the 'man of the moment' last time Parliament got a vote of airstrikes in # Syria and gave that great speech was @ hilarybennmp. He received a lot of abuse from Momentum for doing so. He's not (as far as I can tell) spoken publicly about the current # SyriaStrikes"||@|# #|"985605555040542723"|https://twitter.com/Toriesin6words/status/985605555040542723
charlot73703902|2018-04-15 21:45|0|0|"I get regular emails from conservative news. Tried to post two separate stories just now, received and error notification. But had no problem posting a craft video and a video about Syria hmmm being free speech censored u think maybe??"||||"985605081381797888"|https://twitter.com/charlot73703902/status/985605081381797888
ManaTalk_james|2018-04-15 21:25|0|0|"What Mainstream Media's NOT Telling You About Trump's "Syria Speech!" https://youtu.be/a4ON2Ud6-Yg  via @ YouTube"||@||"985600044744163329"|https://twitter.com/ManaTalk_james/status/985600044744163329
tpdill52|2018-04-15 20:59|0|0|"What Mainstream Media's NOT Telling You About Trump's "Syria Speech!" https://youtu.be/a4ON2Ud6-Yg  via @ YouTube"||@||"985593543870775297"|https://twitter.com/tpdill52/status/985593543870775297
tpdill52|2018-04-15 20:56|0|0|"I liked a @ YouTube video http://youtu.be/a4ON2Ud6-Yg?a  What Mainstream Media's NOT Telling You About Trump's "Syria Speech!""||@||"985592827659857920"|https://twitter.com/tpdill52/status/985592827659857920
MarkMertens3|2018-04-15 20:39|0|0|"What Mainstream Media Is NOT Telling You About Trump’s “Syria Speech” http://dlvr.it/QPd69s"||||"985588316765474816"|https://twitter.com/MarkMertens3/status/985588316765474816
sailorbill1|2018-04-15 18:50|0|0|"What Mainstream Media's NOT Telling You About Trump's "Syria Speech!" https://youtu.be/a4ON2Ud6-Yg  via @ YouTube"||@||"985561075792756737"|https://twitter.com/sailorbill1/status/985561075792756737
realPandava|2018-04-15 18:45|0|0|"You must be confused! The Prez made a speech about what he was doing and why. Did you not tune in? What deep state in Syria? The Western cabal is the deep state."||||"985559633417949184"|https://twitter.com/realPandava/status/985559633417949184
NoSkillJustArt|2018-04-15 18:31|0|1|"# Syria must feel better about expressing their free speech now that the US is taking down the tyrannical part of their government"|||#|"985556251512856577"|https://twitter.com/NoSkillJustArt/status/985556251512856577
kallistobiofuel|2018-04-15 18:25|0|0|"I liked a @ YouTube video http://youtu.be/a4ON2Ud6-Yg?a  What Mainstream Media's NOT Telling You About Trump's "Syria Speech!""||@||"985554796701724674"|https://twitter.com/kallistobiofuel/status/985554796701724674
drewm3i|2018-04-15 17:30|0|0|"I liked a @ YouTube video http://youtu.be/a4ON2Ud6-Yg?a  What Mainstream Media's NOT Telling You About Trump's "Syria Speech!""||@||"985540874330308609"|https://twitter.com/drewm3i/status/985540874330308609
smaxxmahaffey|2018-04-15 17:21|1|3|"Huh? Girl...lol...you are a joke. A highly secure room would never have windows. Wasn't Pence in Peru giving a bogus speech while your boss was pending to lead a raid on Syria that Putin was notified about, then passed on to Assad. Try again chica. https://twitter.com/PressSec/status/985329759759601665 …"||||"985538705694838784"|https://twitter.com/smaxxmahaffey/status/985538705694838784
Reality609|2018-04-15 17:19|0|0|"What Mainstream Media's NOT Telling You About Trump's "Syria Speech!" https://youtu.be/a4ON2Ud6-Yg  via @ YouTube"||@||"985538223391870977"|https://twitter.com/Reality609/status/985538223391870977
AllanFree3|2018-04-15 16:50|0|0|"What Mainstream Media's NOT Telling You About Trump's "Syria Speech!" https://youtu.be/a4ON2Ud6-Yg  via @ YouTube"||@||"985530778967855104"|https://twitter.com/AllanFree3/status/985530778967855104
happaney|2018-04-15 16:47|0|0|"What Mainstream Media's NOT Telling You About Trump's "Syria Speech!" https://youtu.be/a4ON2Ud6-Yg  via @ YouTube"||@||"985530140347322369"|https://twitter.com/happaney/status/985530140347322369
nwoupdate|2018-04-15 16:36|0|0|"Liked on YouTube: What Mainstream Media's NOT Telling You About Trump's "Syria Speech!" https://youtu.be/a4ON2Ud6-Yg"||||"985527176870203394"|https://twitter.com/nwoupdate/status/985527176870203394
LarryParliament|2018-04-15 16:34|0|0|"What Mainstream Media's NOT Telling You About Trump's "Syria Speech!" https://youtu.be/a4ON2Ud6-Yg  via @ YouTube"||@||"985526681401217027"|https://twitter.com/LarryParliament/status/985526681401217027
