username|date|retweets|favorites|text|geo|mentions|hashtags|id|permalink
elpais_america|2018-03-28 17:50|10|6|"La filtración de datos de 50 millones de perfiles de Facebook a Cambridge Analytica para favorecer la campaña electoral de Donald Trump ha tenido un efecto colateral https://elpais.com/tecnologia/2018/03/28/actualidad/1522223639_359867.html …"||||"979022887121293312"|https://twitter.com/elpais_america/status/979022887121293312
WillowLeafstorm|2018-03-28 17:49|0|0|"Where to start? Violation of the Emoluments Clause of the Constitution, nepotism in hiring Jared and Ivanka who have tried to profit from their position in the White House and letting it go on, hiring foreign nationals (Cambridge Analytica) to work on his campaign... pic.twitter.com/JD3FqVc27K"||||"979022745789857792"|https://twitter.com/WillowLeafstorm/status/979022745789857792
EkdikosArises|2018-03-28 17:47|0|0|"# NRA members won’t be able to cut up their cards fast enough when full info is released on how much money NRA took from Russia, and what they used it for: military-grade psyops against America via Cambridge Analytica. NRA betrayed our country and you’re part of it. # NRARussia"|||# #|"979022264934043648"|https://twitter.com/EkdikosArises/status/979022264934043648
ogerom|2018-03-28 17:39|0|0|"You came up with the poll question but it seems you are the one who want to influence the result. I think you should use Cambridge Analytica"||||"979020041147461632"|https://twitter.com/ogerom/status/979020041147461632
akemor|2018-03-28 17:27|1|0|"Emails Link Peter Thiel's # Palantir And Eric Schmidt's Daughter to # Facebook's # CambridgeAnalytica Fiasco - Both Cambridge Analytica and Palantir are owned by conservative billionaires who funded # DonaldTrump's election campaign. # TrumpGatehttps://read.bi/2pHKfS7"|||# # # # #|"979017171618729984"|https://twitter.com/akemor/status/979017171618729984
FloraRijn|2018-03-28 17:21|0|1|"How @ realDonaldTrump won: 1-Trump gets affirmation that Russia supports his candidacy, hacks DNC emails & releases them through Wikileaks 2-Facebook provides personal data on hundreds of thousands voters which Cambridge Analytica hacks to steal millions of voters data"||@||"979015704325378054"|https://twitter.com/FloraRijn/status/979015704325378054
RonnieBissinger|2018-03-28 17:07|0|1|"And Russia and Cambridge analytica;)"||||"979012051258535936"|https://twitter.com/RonnieBissinger/status/979012051258535936
horsecrazybean|2018-03-28 16:59|2|8|"Flynn,Gates,Papadop,Van der Zwann FLIPPED. Manafort INDICTED. 13 Russians INDICTED. Pinedo plea-fake id’s to Russians. Deutsche bank $ laundering. Kush backchannel RU & financially shady. Jr tower mtg. Cambridge Analytica & Facebook &Russia = illegitimate 2016 elections."||||"979010043587776512"|https://twitter.com/horsecrazybean/status/979010043587776512
horsecrazybean|2018-03-28 16:59|1|1|"Flynn,Gates,Papadop,Van der Zwann FLIPPED. Manafort INDICTED. 13 Russians INDICTED. Pinedo plea-fake id’s to Russians. Deutsche bank $ laundering. Kush backchannel RU & financially shady. Jr tower mtg. Cambridge Analytica & Facebook &Russia = illegitimate 2016 elections."||||"979009974344015873"|https://twitter.com/horsecrazybean/status/979009974344015873
horsecrazybean|2018-03-28 16:58|3|6|"Flynn,Gates,Papadop,Van der Zwann FLIPPED. Manafort INDICTED. 13 Russians INDICTED. Pinedo plea-fake id’s to Russians. Deutsche bank $ laundering. Kush backchannel RU & financially shady. Jr tower mtg. Cambridge Analytica & Facebook &Russia = illegitimate 2016 elections."||||"979009748065333248"|https://twitter.com/horsecrazybean/status/979009748065333248
ThinkersPad|2018-03-28 16:56|45|29|"This is the proof of # CongressAnalytica. Congress’ “Hand” behind Cambridge Analytica CEO Alexander Niks. Congress is clearly more prestigious than even Donald Trump, for them. Trump Team paid $15mn. How much did Congress pay, even till August 2017? And how much more for 2019? pic.twitter.com/5UiaVNWFJp"|||#|"979009311761420288"|https://twitter.com/ThinkersPad/status/979009311761420288
Maatjustice4u|2018-03-28 16:56|0|0|"Any thoughts on the millions in Russian/Putin money funneled to @ NRA + @ GOP , fwd to @ realDonaldTrump as well as using Cambridge analytica/Russian hacked Intel? How about John Bolton going to Russia to LOBBY for GUN CONTRACTS?"||@ @ @||"979009309261684736"|https://twitter.com/Maatjustice4u/status/979009309261684736
Instigator75|2018-03-28 16:49|0|0|"We all know what happened. The popular vote went to Hillary but an outdated electoral map and Cambridge Analytica helped you win. 52.5% of the population did not vote for you."||||"979007609666613249"|https://twitter.com/Instigator75/status/979007609666613249
Scientz351|2018-03-28 16:45|0|2|"No argument here, but that fight is won by voting for Democrats at the state level. This Cambridge Analytica story speaks to actual fraud against the voting public on a massive scale."||||"979006556929847297"|https://twitter.com/Scientz351/status/979006556929847297
noidiotsallowed|2018-03-28 16:38|0|0|"so many Cambridge analytica and Russian bots in this profile."||||"979004810711138306"|https://twitter.com/noidiotsallowed/status/979004810711138306
JTaNhWieWki60My|2018-03-28 16:30|0|0|"You certainly did collude but in a way that insulated you. All the evidence is piling up. Cambridge Analytica. Maneuvering around laws to criminal end. Is that what you meant when you said you know how the system is rigged? You’re rigging it now. Impeach."||||"979002777191047168"|https://twitter.com/JTaNhWieWki60My/status/979002777191047168
EdwardHancockII|2018-03-28 16:26|5|16|"Cambridge analytica by itself could do nothing to rig an election. Hillary paid for a dossier of lies, cheated Bernie and colluded with Russia. You libs owe us some "back outrage" over that shit before we can talk about anything else. Either you're mad at injustice or not."||||"979001700559327232"|https://twitter.com/EdwardHancockII/status/979001700559327232
MotivosDeHoy|2018-03-28 16:20|0|0|"La travesura de Cambridge Analytica.-Claudio Lomnitz http://tinyurl.com/y98p496q  ...posiblemente también le debamos la elección de Donald # Trump a # CambridgeAnalytica, y a los datos personales que cosechó mediante # Facebook"|||# # #|"979000310780882946"|https://twitter.com/MotivosDeHoy/status/979000310780882946
TimWaggener|2018-03-28 16:14|0|0|"The irony. Cambridge Analytica literally brainwashed you and the rest of the trumpistas."||||"978998873845743618"|https://twitter.com/TimWaggener/status/978998873845743618
indiannewslink|2018-03-28 16:10|0|0|"Professor William H Dutton After revelations that political consulting firm Cambridge Analytica allegedly appropriated Facebook user data to advise Donald Trump’s 2016 U.S. presidential campaign,... http://www.indiannewslink.co.nz/regulating-facebook-wont-prevent-data-breach/ …"||||"978997821675311105"|https://twitter.com/indiannewslink/status/978997821675311105
horsecrazybean|2018-03-28 15:54|0|0|"Flynn,Gates,Papadop,Van der Zwann FLIPPED. Manafort INDICTED. 13 Russians INDICTED. Pinedo plea-fake id’s to Russians. Deutsche bank $ laundering. Kush backchannel RU & financially shady. Jr tower mtg. Cambridge Analytica & Facebook &Russia = illegitimate 2016 elections."||||"978993689732288512"|https://twitter.com/horsecrazybean/status/978993689732288512
jebocanegra1|2018-03-28 15:54|0|0|"Now we know why it was so easy for Cambridge Analytica to manipulate these morons into voting for @ realDonaldTrump. https://twitter.com/EdKrassen/status/978829781897637888 …"||@||"978993617443442689"|https://twitter.com/jebocanegra1/status/978993617443442689
WTFAmerica123|2018-03-28 15:53|0|0|"Trump’s new security adviser John Bolton also relied on Cambridge Analytica. Sleazy right-wing nut-job Robert Mercer, moron Donald Trump, and war-monger John Bolton are un-American scumbags. # WednesdayWisdomhttps://www.fastcompany.com/40548572/trumps-new-security-advisor-john-bolton-also-relied-on-cambridge-analytica …"|||#|"978993391613693952"|https://twitter.com/WTFAmerica123/status/978993391613693952
hinterlandg|2018-03-28 15:51|2|2|"Remember when Cambridge Analytica owner Robert Mercer sold resigned from his hedge fund and sold his stake in Breitbart last November? Yeah, he knew the data breach scandal was going to come out. They helped Donald Trump win the election. pic.twitter.com/ANPMWID8ON"||||"978992888909582336"|https://twitter.com/hinterlandg/status/978992888909582336
hinterlandg|2018-03-28 15:47|7|10|"I hope Robert Mercer is under investigation by Robert Mueller because he's in up to his neck in Cambridge Analytica scandal that helped # DonaldTrump win the election."|||#|"978991908021264384"|https://twitter.com/hinterlandg/status/978991908021264384
sheatsley_reid|2018-03-28 15:42|1|12|"As opposed to you who is brainwashed by The Mercer’s and Kochs? BTW the Mercer’s literally ran psy-ops campaigns on you via Cambridge Analytica."||||"978990671083331585"|https://twitter.com/sheatsley_reid/status/978990671083331585
martymilner|2018-03-28 15:29|0|2|"Any idea what the Russians were giving money to the NRA for prior to your election? What exactly was the connection between Cambridge Analytica and members of your administration? Ready for Mueller Time yet? Mueller Ain't Going Anywhere # MAGA"|||#|"978987432702963713"|https://twitter.com/martymilner/status/978987432702963713
judemgreen|2018-03-28 15:28|1|1|"Facebook and Cambridge Analytica whistleblower: Donald Trump's election made me speak out - CNBC https://apple.news/AYz3UysR_RCuC7LLrW3gSGg …"||||"978987252792504320"|https://twitter.com/judemgreen/status/978987252792504320
Maatjustice4u|2018-03-28 15:28|0|0|"Any thoughts on the millions in Russian/Putin money funneled to @ NRA + @ GOP , fwd to @ realDonaldTrump as well as using Cambridge analytica/Russian hacked Intel? How about John Bolton going to Russia to LOBBY for GUN CONTRACTS. pic.twitter.com/wIdzCL9WB2"||@ @ @||"978987119380258816"|https://twitter.com/Maatjustice4u/status/978987119380258816
Maatjustice4u|2018-03-28 15:24|0|0|"Any thoughts on the millions in Russian/Putin money funneled to @ NRA + @ GOP , fwd to @ realDonaldTrump as well as using Cambridge analytica/Russian hacked Intel? How about John Bolton going to Russia to LOBBY for GUN CONTRACTS. pic.twitter.com/hMq8wvVoEv"||@ @ @||"978986269949689856"|https://twitter.com/Maatjustice4u/status/978986269949689856
horsecrazybean|2018-03-28 15:21|5|5|"Flynn,Gates,Papadop,Van der Zwann FLIPPED. Manafort INDICTED. 13 Russians INDICTED. Pinedo plea-fake id’s to Russians. Deutsche bank $ laundering. Kush backchannel RU & financially shady. Jr tower mtg. Cambridge Analytica & Facebook &Russia = illegitimate 2016 elections."||||"978985364953104384"|https://twitter.com/horsecrazybean/status/978985364953104384
horsecrazybean|2018-03-28 15:19|1|1|"Flynn,Gates,Papadop,Van der Zwann FLIPPED. Manafort INDICTED. 13 Russians INDICTED. Pinedo plea-fake id’s to Russians. Deutsche bank $ laundering. Kush backchannel RU & financially shady. Jr tower mtg. Cambridge Analytica & Facebook &Russia = illegitimate 2016 elections."||||"978984916166856705"|https://twitter.com/horsecrazybean/status/978984916166856705
horsecrazybean|2018-03-28 15:19|4|11|"Flynn,Gates,Papadop,Van der Zwann FLIPPED. Manafort INDICTED. 13 Russians INDICTED. Pinedo plea-fake id’s to Russians. Deutsche bank $ laundering. Kush backchannel RU & financially shady. Jr tower mtg. Cambridge Analytica & Facebook &Russia = illegitimate 2016 elections."||||"978984883644112896"|https://twitter.com/horsecrazybean/status/978984883644112896
anitabetterlife|2018-03-28 15:08|0|1|"Multiple indictments in Don’s camp, collusion w/Cambridge Analytica, Roger Stone mtg Guccifer2, wikileaks hacking, Manafort changing plank on Ukraine in RNC platform, Kushner wants backchannel to Russians, Erik Prince mtg in Seychelles, Gates mtg w/ Russian spy, papadopulous mtg"||||"978982230449061891"|https://twitter.com/anitabetterlife/status/978982230449061891
GregGerstler|2018-03-28 15:05|0|1|"It would appear, despite @ realDonaldTrump assertions to the contrary, that Cambridge Analytica, a Trump campaign operative, represents the "deep-state" so bemoaned by him. @ GOP Cambridge Analytica Whistle-Blower Contends Data-Mining Swung Brexit Vote https://nyti.ms/2pJ7lHP"||@ @||"978981406029250561"|https://twitter.com/GregGerstler/status/978981406029250561
NewsInnOfficial|2018-03-28 14:47|0|0|"Will Facebook destroy itself? # donaldtrump # data # cambridge # analytica http://newsinn.org/d/a/5727726 pic.twitter.com/fB31ipAO0J"|||# # # #|"978976821873119232"|https://twitter.com/NewsInnOfficial/status/978976821873119232
DTradingAcademy|2018-03-28 14:43|0|0|"Shares in Facebook have dropped over 10% in just a week,Cambridge Analytica, a data firm with ties to President Donald Trump's 2016 election campaign,reportedly accessed information from about 50M $ FB users.http://bit.ly/dtatrade"||||"978975812283138052"|https://twitter.com/DTradingAcademy/status/978975812283138052
ksatnews|2018-03-28 14:20|11|4|"The crisis began on March 16 after Facebook said it was suspending data analysis company Cambridge Analytica for allegedly harvesting data from more than 50 million Facebook users. Cambridge Analytica worked on Donald Trump's presidential campaign. https://www.ksat.com/money/facebook-has-lost-80-billion-in-market-value?utm_source=twitter&utm_medium=social&utm_campaign=snd&utm_content=ksat12 …"||||"978969958100160513"|https://twitter.com/ksatnews/status/978969958100160513
designfeeds|2018-03-28 14:10|0|0|"How data scientists see the future after Facebook's Cambridge Analytica scandal : Data is empowering. Personal information, available online, helped Donald Trump win the presidency, and people's online identities fuel Faceb... https://designfeeds.net/article/how-data-scientists-see-the-future-after-facebooks-cambridge-analytica-scandal …"||||"978967460484272128"|https://twitter.com/designfeeds/status/978967460484272128
SethGoldstein13|2018-03-28 14:07|0|0|"Can’t fix Facebook .50 million plus people had personal data hijacked by rogue Cambridge Analytica to elect fascist @ realDonaldTrump President. Only one solution. # DeleteFacebook"||@|#|"978966715437633538"|https://twitter.com/SethGoldstein13/status/978966715437633538
NancyBraman|2018-03-28 13:52|0|0|"@ realDonaldTrump Another major Trump supporter tied to theft of FB data to help Trump campaign: Peter Thiel Employee Helped Cambridge Analytica Before It Harvested Data https://nyti.ms/2DZV7z8"||@||"978963035967586304"|https://twitter.com/NancyBraman/status/978963035967586304
VernVerass|2018-03-28 13:49|3|5|""But it can’t be overlooked that, just as Cambridge Analytica has begun going down in flames, George Conway is suddenly going hard – almost obsessively hard – after Donald Trump for all to see.""||||"978962305470754816"|https://twitter.com/VernVerass/status/978962305470754816
VernVerass|2018-03-28 13:49|1|1|""Palmer Report can’t help but notice tht George Conway’s public attacks on Donald Trump began just days aftr Cambridge Analytica was outed as having stolen Facebook user data, having secretly met-w-the Russians, & having discussed bribery & blackmail tactics 4 winning elections.""||||"978962295219826689"|https://twitter.com/VernVerass/status/978962295219826689
Occupy_Update|2018-03-28 13:47|0|0|"In case it is forgotten in daily chaos of the White House Cambridge Analytica execs boast of role in getting Donald Trump elected https://www.theguardian.com/uk-news/2018/mar/20/cambridge-analytica-execs-boast-of-role-in-getting-trump-elected …"||||"978961762509840385"|https://twitter.com/Occupy_Update/status/978961762509840385
AdamWelles|2018-03-28 13:44|0|0|"Even with all the help @ realDonaldTrump got from Russia and Cambridge Analytica, he STILL LOST THE POPULAR VOTE BY 3 MILLION."||@||"978961005886795776"|https://twitter.com/AdamWelles/status/978961005886795776
bmangh|2018-03-28 13:38|1|1|"Turns out Donald Trump’s hiring of John Bolton is all about Cambridge Analytica and Trump-Russia http://www.palmerreport.com/analysis/john-bolton-cambridge-analytica/9027/ … via @ PalmerReport"||@||"978959581018771456"|https://twitter.com/bmangh/status/978959581018771456
aewanko|2018-03-28 13:30|0|0|"That is, until Cambridge Analytica became involved because a ton of data were used and became weaponized to make Donald Trump win the (dis)information war on social media leading to the 2016 elections."||||"978957475310288901"|https://twitter.com/aewanko/status/978957475310288901
saadjumbe|2018-03-28 13:25|0|0|"How Cambridge Analytica used your Facebook data to help the Donald Trump campaign in the 2016 election. https://motherboard.vice.com/en_us/article/mg9vvn/how-our-likes-helped-trump-win?utm_campaign=sharebutton … via @ motherboard"||@||"978956282441945088"|https://twitter.com/saadjumbe/status/978956282441945088
longjohnjr|2018-03-28 13:08|0|0|"Cambridge Analytica!!!!"||||"978952007078830080"|https://twitter.com/longjohnjr/status/978952007078830080
longjohnjr|2018-03-28 13:07|0|0|"Cambridge Analytica"||||"978951808742838272"|https://twitter.com/longjohnjr/status/978951808742838272
VivaNoticiasNET|2018-03-28 13:02|0|1|"Aún más fraude en las elecciones: Cambridge Analytica en otro delito por Donald Trump http://bit.ly/2I7Jrwt"||||"978950350563610624"|https://twitter.com/VivaNoticiasNET/status/978950350563610624
Millthorn|2018-03-28 12:55|0|1|"How data scientists see the future after Facebook's Cambridge Analytica scandal Data is empowering. Personal information, available online, helped Donald Trump win the presidency, and people's online identities fuel Facebook's bottom line.  SEE ALSO: … https://ift.tt/2IZYxFu"||||"978948593972318209"|https://twitter.com/Millthorn/status/978948593972318209
LynnBro1023|2018-03-28 12:53|0|0|"What about Stormy or Cambridge Analytica?"||||"978948187946971136"|https://twitter.com/LynnBro1023/status/978948187946971136
ChwaWakili|2018-03-28 12:49|0|0|"Donald “Cambridge Analytica “ Trump"||||"978947277120327680"|https://twitter.com/ChwaWakili/status/978947277120327680
snkw1974|2018-03-28 12:39|0|0|"How data scientists see the future after Facebook's Cambridge Analytica scandal https://ift.tt/2IZYxFu  Data is empowering. Personal information, available online, helped Donald Trump win the presidency, and people's online identities fuel Facebook's bottom line.  SEE ALSO: …"||||"978944579566292992"|https://twitter.com/snkw1974/status/978944579566292992
berge31|2018-03-28 12:38|0|0|"How data scientists see the future after Facebook's Cambridge Analytica scandal https://ift.tt/2IZYxFu  Data is empowering. Personal information, available online, helped Donald Trump win the presidency, and people's online identities fuel Facebook's bottom line.  SEE ALSO: …"||||"978944352167788544"|https://twitter.com/berge31/status/978944352167788544
bkohatl|2018-03-28 12:34|0|1|"No, apparently after the Russian KGB nerve agent attack on the UK the British are very upset and going after vicious, merciless Rebekah Mercer's @ BreitbartNews and Cambridge Analytica and anyone, RUSSIAN KGB/FSB, who participated in TREASON with them across TWO CONTINENTS"||@||"978943286852415488"|https://twitter.com/bkohatl/status/978943286852415488
johnm1966429|2018-03-28 12:23|0|18|"2 words: Cambridge Analytica Your fake news Network is exposed Donny. Only a matter of time now."||||"978940611058429958"|https://twitter.com/johnm1966429/status/978940611058429958
johnm1966429|2018-03-28 12:19|0|0|"2 words: Cambridge Analytica Your propaganda network. It's been exposed Benedict Donald, just a matter of time now."||||"978939741252079618"|https://twitter.com/johnm1966429/status/978939741252079618
getinformed23|2018-03-28 12:13|0|1|"Peter Thiel Employee Helped Cambridge Analytica Before It Harvested Data Interesting. Isn't @ peterthiel the ONLY Silicon Valley CEO to back @ realDonaldTrump? Bannon, Kushner, Parscale, Mercer,Thiel. This "coincidence" is starting to look like a pattern! https://a.msn.com/r/2/BBKNqa6 pic.twitter.com/9K4dt8o0rs"||@ @||"978938009830772737"|https://twitter.com/getinformed23/status/978938009830772737
bkohatl|2018-03-28 11:38|0|1|"I thought that was what @ realDonaldTrump @ VP Mike "Nuremberg Laws" Pence @ SpeakerRyan did when they hired the Russian KGB/FSB & Perverted Merciless Rebekah Mercer hired @ CamAnalytica Cambridge Analytica to commit TREASON/STEAL 2016 Election @ UKParliament investigating for TREASONpic.twitter.com/9u0onfIwTI"||@ @ @ @ @||"978929401210470401"|https://twitter.com/bkohatl/status/978929401210470401
caracal|2018-03-28 10:55|0|0|"Turns out Donald Trump’s hiring of John Bolton is all about Cambridge Analytica and Trump-Russia http://www.palmerreport.com/analysis/john-bolton-cambridge-analytica/9027/ … via @ PalmerReport"||@||"978918404970172418"|https://twitter.com/caracal/status/978918404970172418
stephenkb|2018-03-28 10:39|1|1|"Today’s features Cambridge Analytica, Sierra Leone’s presidential election, Donald Trump’s wall, and more: https://www.newstatesman.com/staggers-morning-call …"||||"978914368661475328"|https://twitter.com/stephenkb/status/978914368661475328
rcevat69|2018-03-28 10:20|4|5|"This is my bigget nightmare, has been since Channel 4 broadcast on Cambridge Analytica On November 5, 2018 a major attack on US power grids will occur. Trump, Ryan and # Teamtreason will respond by decalaring State of Emergency There will be NO elections"|||#|"978909724971290624"|https://twitter.com/rcevat69/status/978909724971290624
cayslue|2018-03-28 10:11|0|0|"@ realDonaldTrump Cambridge Analytica whistleblower Wylie said 3/27 Facebook has ability to spy on users in their homes & offices. British MP Collins said Facebook can through Facebook app on smartphones listen to what people are talking about. Why is Zuckerberg picking his nails?"||@||"978907387636707328"|https://twitter.com/cayslue/status/978907387636707328
bkohatl|2018-03-28 10:08|0|2|"Cambridge Analytica is accused of TREASON across two continents. Working for the Russian KGB/FSB and Vicious @ GOP billionaires TRAITORS Merciless Rebekah Mercer and Cruel Kochs @ BetsyDeVosED @ realDonaldTrump @ VP @ mike_pence @ PressSec @ SHSanders45"||@ @ @ @ @ @ @||"978906616128069632"|https://twitter.com/bkohatl/status/978906616128069632
teamalgoritma|2018-03-28 09:47|0|1|"Beberapa hari terakhir ini, kamu mungkin sering mendengar kasus Cambridge Analytica yang melibatkan Facebook dan juga menyeret nama Donald Trump. Namun, apa itu Cambridge Analytica dan apa yang terjadi di balik itu? Cek yuk di blog post terbaru kita: https://goo.gl/LYnJwx pic.twitter.com/PlRDe9RQpx"||||"978901308521447424"|https://twitter.com/teamalgoritma/status/978901308521447424
clivepivo|2018-03-28 08:33|0|0|""No, no, no, no, The Russians did it" according to the US Government. # blameitonrussia "Christopher Wylie worked for Cambridge Analytica (CA), which is accused of using the private data of 50million Facebook users during Donald Trump’s 2016... https://www.metro.news/app/993647"|||#|"978882712261062656"|https://twitter.com/clivepivo/status/978882712261062656
TrumpDoh|2018-03-28 08:30|2|12|"Hey @ LindseyGrahamSC when exactly did you realize what a problem this whole Cambridge Analytica thing was going to be for you? I'm guessing around the same time you went golfing with Trump."||@||"978881926047174656"|https://twitter.com/TrumpDoh/status/978881926047174656
ndixi_xaan|2018-03-28 08:23|0|2|"Ahora bien, la revelación de la filtración de datos de más de 50 millones de usuarios de Facebook que utilizó la empresa Cambridge Analytica con fines electorales en la campaña presidencial de Donald Trump, elevan a otro nivel el poder del algoritmo yse evidencia manipular masas."||||"978880123754688512"|https://twitter.com/ndixi_xaan/status/978880123754688512
lizette_chapman|2018-03-28 06:45|1|2|"Palantir says it’s continuing its investigation but *so far* just one employee has confirmed helping Cambridge Analytica use Facebook data to target voters and elect @ realDonaldTrump https://www.bloomberg.com/news/articles/2018-03-28/peter-thiel-s-palantir-says-rogue-employee-engaged-with-cambridge-analytica …"||@||"978855577744019458"|https://twitter.com/lizette_chapman/status/978855577744019458
SQLInterstellar|2018-03-28 06:35|0|0|"Facebook is fundamentally in charge of sustaining the examination framework that empowered Cambridge Analytica and the Trump crusade to be so focused on and compelling with a negligible spending plan. They at last won Donald Trump."||||"978853007822589952"|https://twitter.com/SQLInterstellar/status/978853007822589952
Thetruthdenied|2018-03-28 06:12|1|1|"Cambridge Analytica reportedly used the data while doing work in Donald Trump's 2016 presidential campaign, but denies that it misused or even held onto... https://realmoney.thestreet.com/articles/03/19/2018/why-im-watching-att-time-warner-facebook-and-oracle-market-recon …"||||"978847179900116994"|https://twitter.com/Thetruthdenied/status/978847179900116994
AttriForecast|2018-03-28 06:10|0|0|"The # CambridgeAnalytica scandal came to light when whistleblower Wylie accused Cambridge Analytica of gathering details of 50 million Facebook users. Cambridge Analytica used this data to psychologically profile these users and manipulated their opinion in favor of Donald Trump."|||#|"978846656169988096"|https://twitter.com/AttriForecast/status/978846656169988096
CharlesBurns11|2018-03-28 06:03|3|4|"https://www.democracynow.org/2018/3/23/meet_the_american_professor_suing_cambridge … Startling revelations show the company harvested the data of more than 50 million Facebook users, without their permission, in efforts to sway voters to support President Donald Trump. Cambridge Analytica was founded by billionaire Robert Mercer. Trump’s"||||"978845091317067784"|https://twitter.com/CharlesBurns11/status/978845091317067784
