username|date|retweets|favorites|text|geo|mentions|hashtags|id|permalink
khojasteh75|2018-04-14 08:34|3|17|"Until the next hour, the # Iranian leader's strategic speech about the region, the world and the world began. How will Khamenei react to the stupidity of the Arabs and the Tramps at the start of the # Syrianwar? # Syria"|||# # #|"985043562613141504"|https://twitter.com/khojasteh75/status/985043562613141504
2310248gmailco1|2018-04-14 08:13|0|0|"Just saw the speech of Teresa May about the bombing of Syria today. I think she did not have sex for a long time."||||"985038381871697920"|https://twitter.com/2310248gmailco1/status/985038381871697920
darjbrock|2018-04-14 07:32|0|0|"Trump can walk and chew gum, sign pardon papers, tweet about the FBI corruption, make a speech, and decide to bomb Syria all at the same time."||||"985028116325326848"|https://twitter.com/darjbrock/status/985028116325326848
jamesEd_me|2018-04-14 07:30|0|0|"Talk about the US Reaction in Syria and the Trump speech Listen: http://www.cbc.ca/listen/shows/cbc-news-the-world-at-six/segment/159141 … via CBC Radio app"||||"985027568570195968"|https://twitter.com/jamesEd_me/status/985027568570195968
underthematrix|2018-04-14 07:26|0|0|"1 Read the history of Russia in Syria. 2 Russia was supposed to remove all chem weapons from Syria several years ago. 3 Trump's hate speech and actions towards Syrian refugees indicates the strike was more about deflection from his crimes than protection of the Syrian people."||||"985026510049263617"|https://twitter.com/underthematrix/status/985026510049263617
ProgressIsComin|2018-04-14 07:14|0|1|"They called us our about how we shouldn't even threaten syria unilaterally, let alone strike them, based on international law. They called us out about Iraq Lybia and others too. It's worth a watch, I'm sure you can find their isolated speech on the YouTubes"||||"985023541564313600"|https://twitter.com/ProgressIsComin/status/985023541564313600
Raphala_Clinton|2018-04-14 07:11|2|3|"I was watching Trump speech when he was giving those orders to American army to shoot at Syria at about 3AM, you could see the whole Nazi/Zionist in him. He doesn't care about anything but protecting Israel, he doesn't care the millions dying in the name of the US."||||"985022809767280643"|https://twitter.com/Raphala_Clinton/status/985022809767280643
youngboss78|2018-04-14 06:59|0|0|"As Donald Trump Was Giving His Speech About Using Missiles In Syria Reports On The Ground Say As He Was Giving The Speech U.S Bombs Were Hitting the Ground https://www.facebook.com/story.php?story_fbid=1736011816437845&id=100000871303971 …"||||"985019756121116673"|https://twitter.com/youngboss78/status/985019756121116673
Nanso44|2018-04-14 06:45|0|1|"# auspol Not altogether happy about what U.S. /U.K. have done with regard to Syria ( $ expensive & ultimately change nothing) Trumps speech had too much sanctimonious tosh regarding loss of innocent lives for me. Vietnam - agent orange ? Japan - Hiroshima ?"|||#|"985016133915783168"|https://twitter.com/Nanso44/status/985016133915783168
no1important701|2018-04-14 06:32|1|1|"Donald fucking Trump only allowed 11 Syrian refugees into this country this year because Syria is a part of his Muslim ban so save the watch innocent people die speech. This is about him trying to change the news cycle."||||"985012931120304129"|https://twitter.com/no1important701/status/985012931120304129
uglywebsites|2018-04-14 06:31|11|19|"Donald's speech on Syria was about as inspiring as a man standing at a urinal, farting."||||"985012555667025920"|https://twitter.com/uglywebsites/status/985012555667025920
247Newsbeat|2018-04-14 06:30|0|0|"The phrases of Trump's speech about the attack on Syria | U.S https://247newsbeat.com/the-phrases-of-trumps-speech-about-the-attack-on-syria-u-s/ …pic.twitter.com/LT1cD3evYy"||||"985012460464824320"|https://twitter.com/247Newsbeat/status/985012460464824320
filmsnshit|2018-04-14 06:24|1|2|"i don’t know what to say about the blatant murder going on in syria honestly but i always come back to this video & this speech. i don’t know if it’s calming or eye opening or what, but it helps https://youtu.be/-pvxKdvuwIw"||||"985010932534263808"|https://twitter.com/filmsnshit/status/985010932534263808
j0llyBee|2018-04-14 06:00|0|0|"i woke up to news of this trump speech, cohen being investigated, and syria bombed i am so lucky i am speaking tagalog for most of this trip bc i’m not feeling good about broadcasting my americanisms rn"||||"985004752835575809"|https://twitter.com/j0llyBee/status/985004752835575809
tex_rpls|2018-04-14 05:32|0|0|"@ realDonaldTrump Trump’s speech about attacking Syria looked like a guy who’s hostage to the military industrial banker complex."||@||"984997724306198528"|https://twitter.com/tex_rpls/status/984997724306198528
DolphinsDancer|2018-04-14 05:17|0|0|"Soooo.. Sitting on the bus ~hr ago, & getting news alerts about US missile strikes on Syria..and thinking "holy crap..here we go.." This could get bad. Real fast. Oddly..Trump sounds ridiculously almost rational here: http://bit.ly/2qASeAb  HOW'D THAT HAPPEN? Good speech writer?"||||"984993965014503424"|https://twitter.com/DolphinsDancer/status/984993965014503424
OvOstef|2018-04-14 05:11|0|0|"Okay I don’t care what you think of a Trump or his politics, his speech tonight on Syria was amazing. Please watch it and see if you still feel the same way about him. That was a genuine, heartfelt speech."||||"984992436563922945"|https://twitter.com/OvOstef/status/984992436563922945
nemamg|2018-04-14 05:06|0|0|"Bulimic speech by Trump and TV news channels about why attacking and striking. They think people are stupid and will by the show # Syria # EUstopfeedingterrorpic.twitter.com/BAEZQS86aK"|||# #|"984991326885335040"|https://twitter.com/nemamg/status/984991326885335040
psycokip|2018-04-14 04:59|0|2|"Being able to say how you feel about bombing Syria is freedom of speech....honestly remembering where that freedom came from and the price paid is absent in the minds and comments of so many...interesting # SyriaStrike"|||#|"984989425284165632"|https://twitter.com/psycokip/status/984989425284165632
ESTEFAN42345787|2018-04-14 04:56|0|0|"Text of President Donald Trump's speech on Friday night about air strikes against Syria, as provided by the White House"||||"984988823926005760"|https://twitter.com/ESTEFAN42345787/status/984988823926005760
tshirtz22|2018-04-14 04:27|0|1|"@ realDonaldTrump speech tonight about the # # SyrianAirStrikes was the smartest thing I’ve ever heard come out of that mans mouth since he entered office. Innocent people are being killed in Syria and Al-Assad needs to know that those kinds of action are not needed in the world. pic.twitter.com/k2vwSQnCuc"||@|# #|"984981331238146055"|https://twitter.com/tshirtz22/status/984981331238146055
alissa914|2018-04-14 04:16|0|0|"Just heard a speech by @ realDonaldTrump about air strikes in Syria he just launched. He makes periodic references to God and says, "God bless the United States of America." Syria is about 80% Muslim.... so now he basically turned something into a religious war. smh"||@||"984978769680183297"|https://twitter.com/alissa914/status/984978769680183297
Drake_OMalfoy|2018-04-14 04:09|0|0|"When @ MattBevin @ GovMattBevin insane ramblings make Trumps speech about bombing Syria seem reasonable, that's when we know we're in trouble."||@ @||"984976785048776705"|https://twitter.com/Drake_OMalfoy/status/984976785048776705
wachit|2018-04-14 04:06|0|0|"@ realDonaldTrump were you actually throwing kisses to Putin in your speech about Syria???? I guess you are REALLY worried about those peepee tapes."||@||"984976137960001538"|https://twitter.com/wachit/status/984976137960001538
mattrhyssmith|2018-04-14 04:01|0|0|"Say what you want about Teresa May, but she is the person you want in charge during a time of crisis. Someone who is not afraid to act in the national interest. Her speech about Syria this morning show what a good leader she is. # PrayForSyria"|||#|"984974912921264128"|https://twitter.com/mattrhyssmith/status/984974912921264128
rakanbaaj|2018-04-14 03:53|0|1|"Dear @ realDonaldTrump , just saw an compassionate live speech on tv by u.if you so worried about kids in # syria,why did u ban them from getting to USA? God pleas # canada for getting them in.I hope you don’t kill any kids during those attacks u just announced! God keep syrian safe"||@|# #|"984972864452550657"|https://twitter.com/rakanbaaj/status/984972864452550657
LadyJacquelin83|2018-04-14 03:46|0|0|"@ JoeTalkShow was watching the MSNBS reaction to President Trumps speech about the attack on Syria...i cannot believe the venom spued from Rachel Maddow saying this is all a cover to distract from his domestic problems ..she is so off base and full of hate, its pathetic."||@||"984971026625912835"|https://twitter.com/LadyJacquelin83/status/984971026625912835
BrookeMartinTV|2018-04-14 03:45|0|4|"Loud explosions hit Damascus as President Trump told Americans about airstrikes on Syria. Watch the full speech here. http://www.wishtv.com/news/international/trump-to-speak-amid-anticipation-of-strike-for-syrian-chemical-attack/1121043388 …"||||"984970935055810560"|https://twitter.com/BrookeMartinTV/status/984970935055810560
bradyvaux|2018-04-14 03:42|0|2|"I truthfully found Trump’s speech about the decision on Syria to be very well-measured and excellent. I know he can’t always be like this, but this was a very good opportunity and deliverance for @ realDonaldTrump."||@||"984970095687544832"|https://twitter.com/bradyvaux/status/984970095687544832
THEPOET74|2018-04-14 03:40|0|2|"It's just a speech someone wrote for him. He doesn't care about the Syrian people or any other people. I do pray for the men and women in our military, and the people of Syria. @ realDonaldTrump is using this as a distraction, I'm sure Hillary and Obama will come up soon."||@||"984969552818769920"|https://twitter.com/THEPOET74/status/984969552818769920
ManCandLovingIt|2018-04-14 03:39|0|2|"Just watched @ theresa_may speech about # Syria action,it's complete and utter bull which the gullible will easily fall for. She has launched an attack on Trump's say so,the lapdog obeys it's master."||@|#|"984969310841032704"|https://twitter.com/ManCandLovingIt/status/984969310841032704
OKEdKO|2018-04-14 03:37|0|0|"Somehow a man is able to give a speech about the senseless killing of innocent civilians in Syria, and the subsequent missile strike by our country, and all I see are tan lines. On his face. Brava!"||||"984968959492419590"|https://twitter.com/OKEdKO/status/984968959492419590
IndianapolisCP|2018-04-14 03:37|0|0|"Loud explosions hit Damascus as President Trump tells Americans about airstrikes on Syria. Watch the full speech he… http://toplocalnow.com/us/indianapolis/at/21#t14579896 …"|||#t14579896|"984968869558345730"|https://twitter.com/IndianapolisCP/status/984968869558345730
jamescomedyy|2018-04-14 03:31|1|10|"Did you miss Donald’s # SyriaStrikes speech? Let me summarize: “Hey, folks, I’m not a walking talking joke. I’m President!” Sorry, Don, your wag the dog strategy in Damascus won’t work. Bombing Syria won’t make your problems go away. All we care about are your crimes & failures."|||#|"984967442878386176"|https://twitter.com/jamescomedyy/status/984967442878386176
tv_Trey|2018-04-14 03:31|0|1|"Loud explosions hit Damascus as President Trump told Americans about airstrikes on Syria. Watch the full speech here: http://www.wishtv.com/news/international/trump-to-speak-amid-anticipation-of-strike-for-syrian-chemical-attack/1121043388 …"||||"984967401342164994"|https://twitter.com/tv_Trey/status/984967401342164994
DWilliamsTV|2018-04-14 03:31|0|1|"Loud explosions hit Damascus as President Trump told Americans about airstrikes on Syria. Watch the full speech here. http://www.wishtv.com/news/international/trump-to-speak-amid-anticipation-of-strike-for-syrian-chemical-attack/1121043388 …"||||"984967282542743556"|https://twitter.com/DWilliamsTV/status/984967282542743556
SmithKandik1964|2018-04-14 03:29|0|0|"Shannon, before Mr. President spoke I set NBC to record, to see if they would stop programming to show his speech.I Pissed, THEY DID NOT!!! I didn't listen to what they said, they were talking about Syria. When has this EVER happened that shows are interrupted for the POTUS"||||"984966729834082309"|https://twitter.com/SmithKandik1964/status/984966729834082309
asylabeth|2018-04-14 03:29|0|0|"whoever wrote trumps speech about the attack in Syria did a nice job he should keep them on payroll"||||"984966729599193094"|https://twitter.com/asylabeth/status/984966729599193094
GabeBerman|2018-04-14 03:28|0|6|"I’ve never been so physically turned off as I am now after listening to trump snort through a speech about the coming military strikes in Syria while simultaneously talking about god and the righteousness of our economy. I’m frightened. I’m nauseous. And I’m utterly heartbroken."||||"984966541790851072"|https://twitter.com/GabeBerman/status/984966541790851072
WISH_TV|2018-04-14 03:27|1|4|"Loud explosions hit Damascus as President Trump tells Americans about airstrikes on Syria. Watch the full speech here. http://www.wishtv.com/news/international/trump-to-speak-amid-anticipation-of-strike-for-syrian-chemical-attack/1121043388 …"||||"984966409578000384"|https://twitter.com/WISH_TV/status/984966409578000384
unclescorpie|2018-04-14 03:27|27|75|"Saw your speech @ realDonaldTrump. Bs. This is not about national security. Syria can not hit the US. This is an attempt to try, TRY, to look Presidential. BS. I call bs. You are a liar, a coward, and a lardass ass hat. Fuck. You."||@||"984966227935223808"|https://twitter.com/unclescorpie/status/984966227935223808
DownWithData|2018-04-14 03:25|0|0|"feeling a little uneasy sitting about 30min north of @ MacDill_AFB home of @ CENTCOM after the speech from @ realDonaldTrump tonight on # Syria."||@ @ @|#|"984965762539507712"|https://twitter.com/DownWithData/status/984965762539507712
Catch767|2018-04-14 03:25|0|0|"Hi Mr President, just turned on TV & saw you were giving speech about military action in Syria. Hopefully everything will go well. These are really scary times. Please take care of US & all the peace loving nations & take care of yourself too pic.twitter.com/A2avZwffqC"||||"984965719950610432"|https://twitter.com/Catch767/status/984965719950610432
debporrazzo|2018-04-14 03:23|1|1|"So. Surprise, surprise were hitting Syria. Those poor people. A devastated country about to be even more decimated. I wonder who wrote 45's speech? And why he stuck to the script? Something is rotten in the WH. # TrumpResign"|||#|"984965340949032960"|https://twitter.com/debporrazzo/status/984965340949032960
bigndn2011|2018-04-14 03:22|0|0|"The only great deals he has negotiated has to do with making money for himself using the presidential office. His golf course and hotels, etc. Lousy president. Just watched his speech about the attack on Syria. He read it verbatim from the teleprompter."||||"984964984957366272"|https://twitter.com/bigndn2011/status/984964984957366272
ld_connor|2018-04-14 03:18|0|0|"As expected this is rightly about deterring the use of chemical weapons and sending a message to Assad; "sustained response" until he stops using prohibiated substances. The part of speech which reached out to Russia and Iran was interesting but status quo in Syria won't change."||||"984964040278663168"|https://twitter.com/ld_connor/status/984964040278663168
RKYMTMOM|2018-04-14 03:17|0|0|"Good speech from DT about strikes on Syria. Makes me ask, who wrote it? Certainly not DT."||||"984963925539196929"|https://twitter.com/RKYMTMOM/status/984963925539196929
a3poify|2018-04-14 03:17|0|1|"When Trump started talking about "righteous power" in his # Syria speech it all started getting a bit Year Zero. @ nineinchnails # nin"||@|# #|"984963711571038209"|https://twitter.com/a3poify/status/984963711571038209
VitruvianMonkey|2018-04-14 03:15|2|3|"So, hype either way is bullshit. This is just another temporary stop-gap measure in Syria. It isn’t war, but it isn’t nothing. I think the more important part was the weird end of the speech where he talked more vaguely about foreign policy."||||"984963356946845697"|https://twitter.com/VitruvianMonkey/status/984963356946845697
SusannaHawkins1|2018-04-14 03:14|0|0|"Whew. God help us all. President Trump stayed on point and delivered a coherent speech about our presence in Syria which included a strong reprimand to Russia. This all in response to Assad's chemical attack on the Syrian ppl. Lord, have mercy."||||"984963144840826882"|https://twitter.com/SusannaHawkins1/status/984963144840826882
katnicho7608|2018-04-14 03:14|4|12|"So, it appears we're about to blow up some things in Syria tonight. I pray our men and women are safe and we're protecting the people of Syria. Listening to @ realDonaldTrump speech, only one thing is certain: his teleprompter displays 4 words at a time, and none of them are his."||@||"984963099819200513"|https://twitter.com/katnicho7608/status/984963099819200513
ShakyKnee|2018-04-14 03:14|0|2|"*looks around nervously* I thought the President’s speech about Syria was pretty good *runs away*"||||"984963083079741441"|https://twitter.com/ShakyKnee/status/984963083079741441
katnicho7608|2018-04-14 03:13|0|0|"So, it appears we're about to blow up some things in Syria tonight. I pray our men and women are safe and we're protecting the people of Syria. Listening to @ realDonaldTrump speech, only one thing is certain: his teleprompter displays 4 words at a time, and none of them are his."||@||"984962813687975938"|https://twitter.com/katnicho7608/status/984962813687975938
RansonKeith|2018-04-14 03:13|0|1|"I am astounded bye president Trump's speech tonight about the strike on Syria! I must say as crummy as he is as a person this was his best speech ever first time ever sounded like a human being? I know it won't last I do not believe!"||||"984962709170130946"|https://twitter.com/RansonKeith/status/984962709170130946
mdub2829|2018-04-14 03:13|0|0|"Re: trump’s scripted speech on air strikes in Syria, the last part about we pray for etc. ..nah. I don’t buy that. # WaggingTheDog"|||#|"984962692569075713"|https://twitter.com/mdub2829/status/984962692569075713
djsilverfox42|2018-04-14 03:12|0|1|"Hahahahaha who wrote his speech sounded like a broken record speech. It seems letting Syria know about what you are doing you just told them that your basically declaring war as before your domestic problems have become international please get rid of this guy"||||"984962602987122689"|https://twitter.com/djsilverfox42/status/984962602987122689
melinda_lu18|2018-04-14 03:12|0|0|"Trump sniffed his whole way through his TelePrompTer speech. Guess Trump thought his attack on Syria will stop the talk about Cohen, Obstruction, Firings and Stormy Daniels - NOT! @ realDonaldTrump @ POTUS # ScandalPresident"||@ @|#|"984962491523436545"|https://twitter.com/melinda_lu18/status/984962491523436545
jgunned|2018-04-14 03:11|0|2|"In the same speech as announcing further intensive attacks on Syria, he brags about eliminating ISIS. Wasn’t that the whole point of the US being in Syria? If they’re eliminated..."||||"984962274711531520"|https://twitter.com/jgunned/status/984962274711531520
DarceyWMorris|2018-04-14 03:11|0|1|"The craziest part (ok it’s all crazy) of this speech is seeing news about 45’s lawyer under criminal investigation for paying off porn stars scroll underneath 45 announcing we bombed Syria. I’m ready to wake up now!!"||||"984962238627926016"|https://twitter.com/DarceyWMorris/status/984962238627926016
xChiefxGamingx|2018-04-14 03:10|0|0|"@ PhillyD thoughts on the president's speech about Syria?"||@||"984962065478705152"|https://twitter.com/xChiefxGamingx/status/984962065478705152
SherrieBabee|2018-04-14 03:09|1|3|"Trump speech on Syria going on right now... on evil.. We will try to rid the world of evil. How about we start with YOU?!? pic.twitter.com/Uto6XdCpZ0"||||"984961870951010304"|https://twitter.com/SherrieBabee/status/984961870951010304
ResistanceZone|2018-04-14 03:09|3|9|"I like how he randomly touted the economy in a speech about striking Syria."||||"984961837937713152"|https://twitter.com/ResistanceZone/status/984961837937713152
Truthsayer2016_|2018-04-14 03:08|0|0|"Can someone fact check this @ realDonaldTrump speech about Syria....I don’t trust him @ ABC @ CNN @ NBCNews"||@ @ @ @||"984961632471343104"|https://twitter.com/Truthsayer2016_/status/984961632471343104
cmclymer|2018-04-14 03:07|1486|6614|"I guarantee: 1) Trump was not involved in the writing of this speech. At all. 2) Trump didn't see this speech until just now. 3) Trump couldn't find Syria or Iran on a map. 4) Trump has no idea what the true status is on ISIS and would be completely lost if asked about it."||||"984961363071131648"|https://twitter.com/cmclymer/status/984961363071131648
carpediemer52|2018-04-14 03:07|0|0|"I finally had to mute his speech. I could no longer stomach hearing him profess to caring about the children and people of Syria. This is a deflection from a very bad week. https://twitter.com/smerconish/status/984959827163205633 …"||||"984961353009033218"|https://twitter.com/carpediemer52/status/984961353009033218
LKM_juve|2018-04-14 03:07|0|2|"The ironic part about Trump speech is he condoning Russia and china’s support of Syria’s regime. While Usa supports Israel, Egypt, Saudi Arabia and the list goes on. Again this is in no way shape or form supporting Assad but the irony is unbelievable."||||"984961288907485186"|https://twitter.com/LKM_juve/status/984961288907485186
davidwade|2018-04-14 03:07|31|176|"President Trump quotes referring to Russia in this speech about # Syria missile strike: "The nations of this world can be judged by the friends they keep..." "Russia must decide if it will continue down this dark path..." "Hopefully some day we will get along with Russia.""|||#|"984961206040649728"|https://twitter.com/davidwade/status/984961206040649728
publichistory|2018-04-14 03:07|0|0|""The United States has a lot to offer ..." in a speech about striking Syria"||||"984961198234963968"|https://twitter.com/publichistory/status/984961198234963968
Democacy2017|2018-04-14 03:06|0|3|"I bet he will also slip into his speech a “believe me, Rod Rosenstein is also fired, this I can tell you” amongst his incoherent ramblings about attacking Syria."||||"984961068526129153"|https://twitter.com/Democacy2017/status/984961068526129153
wilkster2|2018-04-14 03:05|0|0|"When is Cheetolini gonna start bitching about Lyin’ Comey in this Syria speech?"||||"984960887516737538"|https://twitter.com/wilkster2/status/984960887516737538
schmeisy|2018-04-14 03:04|0|2|"Trump just started his speech about Syria. Okay taking bets. How long before Trump mentions Crooked Hillary?"||||"984960526840139777"|https://twitter.com/schmeisy/status/984960526840139777
Lindsay5607|2018-04-14 03:03|0|1|"Will this speech only be about Syria... or does he have another surprise up his sleeve?"||||"984960190654177280"|https://twitter.com/Lindsay5607/status/984960190654177280
nudememphis|2018-04-14 03:02|0|3|"Oh, for crying out loud, instead of tonight's episode of # AgentsofSHIELD we're watching President Trump making a speech about launching missiles in Syria. Couldn't we just read about this tomorrow in the fake news?"|||#|"984960137503879168"|https://twitter.com/nudememphis/status/984960137503879168
StevePayaslian|2018-04-14 03:02|0|0|"Trump to make a speech about Syria. He'll be talking about Hillary and Comey and how he won the election in a land slide."||||"984960126112161792"|https://twitter.com/StevePayaslian/status/984960126112161792
SatansToast|2018-04-14 03:00|0|0|"They’re gearing up for a major # WhiteHouse announcement tonight. Probably about # Syria, but I’m hoping & praying it’s Trump’s resignation speech."|||# #|"984959645541388288"|https://twitter.com/SatansToast/status/984959645541388288
alexsobe123|2018-04-14 02:59|0|1|"From what I can tell, he’s gonna talk about action against Syria @9. Think it’ll be a teleprompter speech or free riff?"||@9||"984959226937335808"|https://twitter.com/alexsobe123/status/984959226937335808
actorgenegray|2018-04-14 02:59|0|0|"@ billmaher it will be interesting to hear what you have to say about Trump’s Syria speech tonight on your show."||@||"984959182356058113"|https://twitter.com/actorgenegray/status/984959182356058113
groovatron2000|2018-04-14 02:58|0|0|"Great. Trump is about to give a speech regarding Syria. We are all fucked."||||"984959088726601728"|https://twitter.com/groovatron2000/status/984959088726601728
msevereddin|2018-04-14 02:58|0|0|"Well Trump is due to give a speech about Syria in about 5 minutes - so hang on!"||||"984958918270111744"|https://twitter.com/msevereddin/status/984958918270111744
DanielAshley13|2018-04-14 02:56|0|0|"@ realDonaldTrump is going to be on TV in a few minutes. Apparently, it will be a speech about retaliating against Syria for the chemical weapons that they used on their own people. I'll be watching baseball. # TrumpOnTV # OrangeClownAlert"||@|# #|"984958457035051008"|https://twitter.com/DanielAshley13/status/984958457035051008
EpicEyeRoll|2018-04-14 02:55|0|1|"Prediction: During Trump’s speech about # Syria, # RodRosenstein will be fired."|||# #|"984958248943063040"|https://twitter.com/EpicEyeRoll/status/984958248943063040
evacool_|2018-04-14 02:52|4|5|"# Breaking # Trump will deliver a speech about # Syria in 30 minutes, in which he is expected to identify the responsible for the # ChemicalAttack in # Douma and the # USA response to the attack. # Assad # Russia # Iran # France # UKpic.twitter.com/MHhY7PMKnP"|||# # # # # # # # # # #|"984957495356641280"|https://twitter.com/evacool_/status/984957495356641280
